000000018893.jpg#2,an orange cat is curled up on backpacks
000000018893.jpg#3,a cat laying on top of a bag on the floor
000000018893.jpg#4,An orange cat laying on a colorful backpack.
000000530367.jpg#0,A white cat laying on a zebra striped blanket.
000000530367.jpg#1,A white cat is asleep on a black and white striped rug.
000000530367.jpg#2,A white house cat laying on a zebra striped blanket grooming itself.
000000530367.jpg#3,A white colored cat laying on a black and white zebra colored pillow.
000000530367.jpg#4,A white cat curled up on a zebra striped floor rug
000000040931.jpg#0,A cat sitting  under a car on top of a road.
000000040931.jpg#1,a cat sitting underneath a vehicle on the cement ground
000000040931.jpg#2,a close up of a cat under something 
000000040931.jpg#3,The kitten is busy hiding below the car.
000000040931.jpg#4,A cat curled up and hiding under a gray object.
000000550767.jpg#0,A cat perched on top of a picture frame.
000000550767.jpg#1,a close up of a cat sitting on a pillar
000000550767.jpg#2,black and white cat perched beside a black and white picture
000000550767.jpg#3,a gray and white cat sitting on top of a black speaker near a television
000000550767.jpg#4,A black and white cat sitting on a pedestal next to a picture. 
000000126324.jpg#0,A cat sleeping on top of a wooden bench.
000000126324.jpg#1,A calico cat with a pink nose laying on a wooden bench.
000000126324.jpg#2,A cat laying comfortably on a fence rail
000000126324.jpg#3,A cat stretching out on a wooden bench.
000000126324.jpg#4,A cat laying on a wood bench looking into a camera.
000000138699.jpg#0,A siamese cat sniffing yellow and red flowers in a vase.
000000138699.jpg#1,an image of a cat that is smelling flowers
000000138699.jpg#2,A cat sniffing flower blooms in a vase.
000000138699.jpg#3,A cat is sniffing at colorful flowers in a clear vase.
000000138699.jpg#4,a close up of a cat near a vase with flowers
000000438912.jpg#0,A white and brown cat sitting inside of a white bowl.
000000438912.jpg#1,A cat sitting in a bowl on a table.
000000438912.jpg#2,The kitten is taking a nap in the dish.
000000438912.jpg#3,A cat is sitting smugly on top of a bowl on a table.
000000438912.jpg#4,A cat that is laying down with its eyes closed.
000000067995.jpg#0,A cat laying on top of a blanket near a wall.
000000067995.jpg#1,a cat looking up laying on a bed
000000067995.jpg#2,A black and white cat sitting in dappled sunlight.
000000067995.jpg#3,"A cat sitting on a bedspread, staring off to the distance.
"
000000067995.jpg#4,a cat that is sitting on top of a blanket
000000490503.jpg#0,A black and white cat sitting on top of a bed.
000000490503.jpg#1,A kitty cat is sitting on a bed wearing a collar with a heart charm.
000000490503.jpg#2,A black and white cat with a heart shaped collar on a bed.
000000490503.jpg#3,A cat on a bed curiously looking at the camera.
000000490503.jpg#4,A cat with a collar and heart tag sitting on a bed
000000402177.jpg#0,A person and their cat sitting on a rock outside in the forest.
000000402177.jpg#1,A cat and a person sitting on a rock.
000000402177.jpg#2,A cat is sitting on the stone with the man
000000402177.jpg#3,a person that is sitting next to a cat
000000402177.jpg#4,A cat lies beside a person sitting on a  rock.
000000380525.jpg#0,A cat that is looking at a pastry.
000000380525.jpg#1,A cat sniffing at a powdered jelly doughnut.
000000380525.jpg#2,A large gray cat eating a lemon jelly doughnut.
000000380525.jpg#3,A grey cat is hovering over a lemon filled doughnut.
000000380525.jpg#4,A grey cat smelling a cut filled donut on a plate.
000000463669.jpg#0,A black and white cat laying on top of a blue blanket.
000000463669.jpg#1,The cat can barely keep his eyes open.
000000463669.jpg#2,A black and white cat lies on the ground with one eye towards the camera.
000000463669.jpg#3,a black an white cat sleeping on a blue blanket
000000463669.jpg#4,The cat is resting peacefully during her nap.
000000332439.jpg#0,A cat sits and ponders on a couch.
000000332439.jpg#1,A cat sitting on a couch looking intently at something.
000000332439.jpg#2,A brown cat sitting on a grey couch.
000000332439.jpg#3,The cat is perched comfortably on the couch.
000000332439.jpg#4,A cute cat sitting on top of a couch cushion.
000000451381.jpg#0,A grey and white striped tabby cat laying inside a black suitcase.
000000451381.jpg#1,A fat cat sitting on luggage while staring at something. 
000000451381.jpg#2,A brown cat is partly nestled inside a black bag.
000000451381.jpg#3,"A furry cat sits inside of an open, black suitcase. "
000000451381.jpg#4,A cat that is laying on top of some luggage.
000000049062.jpg#0,A cat lays down on a plastic chair.
000000049062.jpg#1,A small orange cat laying on a blue surface.
000000049062.jpg#2,an orange and white cat is sitting on a blue chair
000000049062.jpg#3,The orange cat is sitting down outside on the chair. 
000000049062.jpg#4,A cat sitting outside on a blue chair. 
000000180738.jpg#0,Cat siblings sitting on a sunny window sill
000000180738.jpg#1,One cat is sitting in the windowsill and another cat sitting below the other one.
000000180738.jpg#2,"Two cats are sitting next to a window, with one on the window sill."
000000180738.jpg#3,Two cats sitting in front of a windowsill.
000000180738.jpg#4,Two cats are standing by a closed window
000000379165.jpg#0,A cat naps while cuddling a computer mouse.
000000379165.jpg#1,A tawny cat naps on top of a piece of machinery or electronics.
000000379165.jpg#2,Orange cat sleeping on top of a remote.
000000379165.jpg#3,an image of a cat sleeping by a mouse
000000379165.jpg#4,A yellow and white kitten laying on a black computer mouse.
000000061403.jpg#0,A cat is on a motorcycle gas tank.
000000061403.jpg#1,The cat is sitting on top of the motorcycle.
000000061403.jpg#2,A black and white cat is standing on the back of a motorcycle.
000000061403.jpg#3,A cat sitting on the back of a motor bike.
000000061403.jpg#4,A cat stands on the storage compartment of a motor bike.
000000085933.jpg#0,A brown and black cat laying on bed with pillows.
000000085933.jpg#1,A cat laying in a bed in a room.
000000085933.jpg#2,there is a cat that is laying down in a bed
000000085933.jpg#3,The large cat is laying down on the bed. 
000000085933.jpg#4,A cat is lying down on a bed and relaxing.
000000270034.jpg#0,The cat is wearing a clip on tie.
000000270034.jpg#1,a close up of a cat wearing a tie 
000000270034.jpg#2,A gray and white cat is wearing a tie
000000270034.jpg#3,A grey and white cat wearing a tie.
000000270034.jpg#4,A gray and white cat wearing  a plaid tie
000000146767.jpg#0,A cat laying next to a stainless steel bowl.
000000146767.jpg#1,a close up of a cat near a bowl
000000146767.jpg#2,A gray cat laying on the floor next to a food dish.
000000146767.jpg#3,A grey cat is laying next to a metal bowl.
000000146767.jpg#4,Cat laying down with a bowl in front of it.
000000460505.jpg#0,A cat sitting in a black piece of luggage.
000000460505.jpg#1,A grey cat sitting in a large black bag.
000000460505.jpg#2,A brown cat sleeping in a black piece of luggage.
000000460505.jpg#3,Grey long-haired cat resting in a dufflebag. 
000000460505.jpg#4,The large cat is laying down in the suitcase. 
000000281296.jpg#0,a woman and her cat nervously look at the camera
000000281296.jpg#1,A woman sitting down with a cat on her lap.
000000281296.jpg#2,A woman is shown snuggling with her cat.
000000281296.jpg#3,A woman wearing a red sweater holding a cat.
000000281296.jpg#4,In person cuddling in a blanket with a cat
000000094444.jpg#0,"Two grey cats laying down, looking out a window"
000000094444.jpg#1,Two fat cats contentedly watching out a window.
000000094444.jpg#2,Two cats resting on a chair next to a window.
000000094444.jpg#3,Two gray cats sitting on a cushion staring out a window 
000000094444.jpg#4,Two cats laying and staring out a window.
000000137206.jpg#0,A long haired black cat laying on a remote control. 
000000137206.jpg#1,A cat laying down with it's tongue stuck out.
000000137206.jpg#2,The cat likes to sleep with the remote from the tv.
000000137206.jpg#3,a cat lays down on a remote control 
000000137206.jpg#4,A cat that is sleeping on top of a remote control.
000000542946.jpg#0,A small black cat is sitting in a flower pot.
000000542946.jpg#1,A cat observantly looks around the yard while sitting in a large pot.
000000542946.jpg#2,a cat in a pit on the ground on leaves
000000542946.jpg#3,A small black cat sitting a blue flower pot.
000000542946.jpg#4,A black cat sitting in a pottery bucket
000000544590.jpg#0,a close up of a cat laying on a couch
000000544590.jpg#1,A close up of a cat reclining on a chair
000000544590.jpg#2,A cat resting on a furniture of some sort.
000000544590.jpg#3,a cat lying on a couch with one paw extended.
000000544590.jpg#4,An orange cat lies down on top of a sofa. 
000000446409.jpg#0,A tabby cat laying on a cat scratcher in front of a bicycle wheel. 
000000446409.jpg#1,A cat is falling asleep on top of a scratching pad.
000000446409.jpg#2,a cat laying down next to a bike tire
000000446409.jpg#3,A cat is resting underneath a bicycle wheel.
000000446409.jpg#4,A cat is laying on a small piece of rough fabric
000000137413.jpg#0,a cat laying in a box next to an open suitcase
000000137413.jpg#1,Cat lying on desk near a chair top. 
000000137413.jpg#2,a cat lying on the chair with its eyes wide open
000000137413.jpg#3,Adult cat laying in a box on a table
000000137413.jpg#4,a cat that is laying down in a box
000000199570.jpg#0,An orange and white cat laying on top of a laptop computer.
000000199570.jpg#1,a close up of a cat laying on a laptop
000000199570.jpg#2,A cat that is laying down with it's head on a laptop.
000000199570.jpg#3,An orange and white cat sleeping with its head on the keyboard of a laptop computer
000000199570.jpg#4,A cat rests her head on a laptop computer.
000000168948.jpg#0,A black cat sits on the arm of a red couch.
000000168948.jpg#1,A cat laying on the arm of a sofa. 
000000168948.jpg#2,A black cat lying on a red couch
000000168948.jpg#3,Cat laying on red pillow with one paw extended 
000000168948.jpg#4,A black cat lounges on a red couch. 
000000271002.jpg#0,A fluffy gray cat lazing on a bed.
000000271002.jpg#1,A grey cat laying on a bed with a light blue sheet.
000000271002.jpg#2,a close up of a cat laying on a bed 
000000271002.jpg#3,Fuzzy cat lying on the back of a slip covered couch.
000000271002.jpg#4,a cat lays down on a bed 
000000526721.jpg#0,The cat was eating out of her bowl which was sitting on the floor.
000000526721.jpg#1,A cat that is eating out of a silver bowl. 
000000526721.jpg#2,a cat has its face in a white bowl
000000526721.jpg#3,A cat eating out of a glass bowl on top of a hardwood floor.
000000526721.jpg#4,a cat eating some food out of a ball 
000000558317.jpg#0,A cat laying next to a computer keyboard.
000000558317.jpg#1,A cat sits in front of a laptop.
000000558317.jpg#2,A cat staring at something while in front of a laptop. 
000000558317.jpg#3,A side view of a cat in front of a computer are shown.
000000558317.jpg#4,a cat is sitting in front of a laptop
000000206656.jpg#0,A cat sits on the couch next to the remote.
000000206656.jpg#1,A brown cat sitting beside a remote control 
000000206656.jpg#2,A large cat is sitting on the arm of the chair.
000000206656.jpg#3,a orange striped cat standing on the corner of a couch next to a remote 
000000206656.jpg#4,Cat sitting on couch arm with remote in front of it
000000449150.jpg#0,A cat is about to have its teeth brushed. 
000000449150.jpg#1,A kitten with her head cocked to one side as someone attempts to brush the kitten's teeth.
000000449150.jpg#2,A picture of a cat looking at something.
000000449150.jpg#3,A gray stripped cat holds its face toward a red toothbrush.
000000449150.jpg#4,a cat looking curious at a suspended toothbrush.
000000480720.jpg#0,A cat looking at his reflection in the mirror.
000000480720.jpg#1,A cat that is looking in a mirror.
000000480720.jpg#2,A cat looking at itself in a mirror.
000000480720.jpg#3,A cat looking at itself adoringly in a mirror.
000000480720.jpg#4,A cat stares at itself in a mirror. 
000000518081.jpg#0,"A cat sitting on a toilet, next to a shower."
000000518081.jpg#1,A cat sitting on a toilet in a room.
000000518081.jpg#2,A cat in a bathroom sits on the lid of the commode.
000000518081.jpg#3,A fluffy gray cat sitting on the toilet bowl
000000518081.jpg#4,The fluffy cat is sitting on top of a toilet in the bathroom. 
000000541229.jpg#0,A cat laying on a piece of fabric.
000000541229.jpg#1,A cat laying on top of a comfy bed with it's eyes open.
000000541229.jpg#2,Small cat on the bed lounging among the blankets.
000000541229.jpg#3,a small cat laying down on the bed with a blanket on the bed
000000541229.jpg#4,A cat rests on a bed in the dark.
000000519716.jpg#0,a white cat sleeping in a wicker chair covered with a blanket
000000519716.jpg#1,A white cat sleeps in a blanketed basket.
000000519716.jpg#2,White cat curled up asleep in a blanketed chair
000000519716.jpg#3,A white long-haired adult cat sleeping in a wicker chair.
000000519716.jpg#4,A cat sleeping in a wicker seat with a green blanket
000000349573.jpg#0,A cat looking at the camera with a television in the background.
000000349573.jpg#1,A cat standing in front of a TV in a living room. 
000000349573.jpg#2,A cat sitting on a table with a tv on behind it.
000000349573.jpg#3,a cat starring at the camera and a television in the background
000000349573.jpg#4,a cat in front of the tv giving a disapproving look
000000474667.jpg#0,A person holding a black cat next to their face.
000000474667.jpg#1,"A teenager with acne, holding up a black cat."
000000474667.jpg#2,A person looks at the camera while holding a black cat.
000000474667.jpg#3,a person is holding up a black cat
000000474667.jpg#4,A man with a black kitten is staring at the viewer.
000000045882.jpg#0,"A long haired, black cat with yellow eyes lays on a black suitcase."
000000045882.jpg#1,A black and brown cat sitting on a suitcase.
000000045882.jpg#2,a cat laying on a pad on the floor
000000045882.jpg#3,A large fluffy cat laying down on top of a bed.
000000045882.jpg#4,A cat is staring while sitting on a suitcase.
000000490725.jpg#0,A cat laying on top of a chair with pillows.
000000490725.jpg#1,A cat sleeping on the arm of a couch under a window.
000000490725.jpg#2,An orange cat sleeping on the arm of a sofa.
000000490725.jpg#3,a close up of a cat laying on a couch
000000490725.jpg#4,A cat sleeping on a  sofa by a window
000000123765.jpg#0,Striped cat peering outside an open inside window.
000000123765.jpg#1,a cat standing on its hind legs with its front legs resting on the steps of a ladder.
000000123765.jpg#2,A kitten is standing in a refrigerator shelf.
000000123765.jpg#3,A small kitten stands inside a open fridge draw starring to the right .
000000123765.jpg#4,an image of a kitten that is looking out the window
000000371773.jpg#0,The cat is sitting in the bathroom sink. 
000000371773.jpg#1,a cat is sitting in the bathroom sink
000000371773.jpg#2,A white cat sitting in a white sink.
000000371773.jpg#3,A siamese cat sitting inside of a white sink.
000000371773.jpg#4,Siamese cat sitting in a bathroom wash basin
000000580162.jpg#0,A black and white cat laying on top of a microwave.
000000580162.jpg#1,A small kitten relaxing on top of a metallic microwave.
000000580162.jpg#2,A black cat sitting alert on the table.
000000580162.jpg#3,A gray and white cat perched atop a microwave oven
000000580162.jpg#4,A grey and white cat laying down on top of a microwave.
000000168146.jpg#0,A cat that is laying on a bed looking at the wall.
000000168146.jpg#1,A cat sitting on the corner of a bed.
000000168146.jpg#2,A black and white cat laying on a bed
000000168146.jpg#3,A black and white cat sitting on a bed.
000000168146.jpg#4,A cat sits on the corner edge of a bed.
000000409652.jpg#0,A white and black cat sitting next to a vase of flowers.
000000409652.jpg#1,A black and white cat sits on a table with a colored flower vase
000000409652.jpg#2,a big cat sitting next to a vase with flowers.
000000409652.jpg#3,A very cute cat sitting next to some flowers.
000000409652.jpg#4,A cat sitting next to a vase of daffodils by the window.
000000546622.jpg#0,A cat laying on top of a chair as it sleeps.
000000546622.jpg#1,An orange and white kitten laying on a chair.
000000546622.jpg#2,The cat stretches out on the colorful padded chair.
000000546622.jpg#3,A yellow and white cat sleeps on its back on a chair.
000000546622.jpg#4,A cat sprawls out and sleeps on its back on a lounge chair with an acorn theme.
000000292993.jpg#0,A Siamese cat sitting in front of a mirror.
000000292993.jpg#1,This blue eyed cat is staring into a hand mirror.
000000292993.jpg#2,The cat is observing its own visage in the circular make-up mirror.
000000292993.jpg#3,A cat is looking at its reflection in a mirror.
000000292993.jpg#4,A cat's face is reflected in a round magnifier mirror.
000000531883.jpg#0,The stuffed mount of hyenas attacking what appears to be a zebra.
000000531883.jpg#1,"A stuffed predator, chasing the leg of a zebra."
000000531883.jpg#2,A display two hyenas attacking a zebra. 
000000531883.jpg#3,Taxidermy scene of two hyenas chasing a zebra.
000000531883.jpg#4,A taxidermy  zebra being chased and bitten by hyenas.
000000008829.jpg#0,A persons foot is near a small kitten on some lawn.
000000008829.jpg#1,A small grey kitten standing next to a persons foot.
000000008829.jpg#2,A tiny kitten walks in the grass around somebody's foot.
000000008829.jpg#3,a kittien walking by a red and black sneaker in the grass 
000000008829.jpg#4,A small grey and white kitten stands next to a foot.
000000128679.jpg#0,A gray and white cat sitting in window next to a tiger cat.
000000128679.jpg#1,Two cats seated in front of a window with captions.
000000128679.jpg#2,Two cats are sitting on a window seal
000000128679.jpg#3,Two cats are sitting on a house window sill.
000000128679.jpg#4,Two different colored cats sitting in a window sill among the curtains.
000000306855.jpg#0,A cat that is standing on a chair and looking at the ground.
000000306855.jpg#1,A cat sitting on the edge of a chair looking at something on the floor 
000000306855.jpg#2,a cat sitting in a chair leaned up against the wall
000000306855.jpg#3,A kitten sits on the edge of a chair and watches something on the floor.
000000306855.jpg#4,A kitten stands on a chair and looks over the edge. 
000000279899.jpg#0,A cat that is sitting on a bikes basket.
000000279899.jpg#1,a close up of a cat on a basket on a bike 
000000279899.jpg#2,A cat sitting on top of a bike's basket. 
000000279899.jpg#3,An orange tabby cat stands on a basket on a bike's handlebars.
000000279899.jpg#4,This is a cat on top of a bicycle's basket.
000000453472.jpg#0,A cat sitting next to a plant under a chair.
000000453472.jpg#1,A grey cat sitting next to a basket
000000453472.jpg#2,A grey long hair cat next to a green unopened umbrella.
000000453472.jpg#3,a gray cat is looking around while laying down
000000453472.jpg#4,A gray  furry cat laying near an umbrella
000000315073.jpg#0,A cat with it's mouth wide open laying next to an open blue bottle on a window sill.
000000315073.jpg#1,A cat sitting on a chair sticking out its tongue.
000000315073.jpg#2,A cat sit on a blanket with it's mouth open.
000000315073.jpg#3,A cat yawning next to a blue bottle. 
000000315073.jpg#4,A grey adult cat opens its mouth very wide.
000000271907.jpg#0,A picture of a cat wearing a bow tie.
000000271907.jpg#1,A close up of a cat who is wearing a bow tie.
000000271907.jpg#2,An orange and white cat with a polka dotted bow around her neck.
000000271907.jpg#3,The orange and white cat is wearing a bow tie. 
000000271907.jpg#4,A cat wearing a polka dot bow tie
000000162206.jpg#0,A cat sitting on a window sill next to a sports bottle.
000000162206.jpg#1,a black and white cat looking at a blue bottle
000000162206.jpg#2,The cat laying on the window sill sniffs a blue water bottle.
000000162206.jpg#3,A cat is curious about a neoprene water bottle
000000162206.jpg#4,A cat in a window sill inspects a blue water bottle
000000397045.jpg#0,A cat sitting on the back of a bench while looking upward. 
000000397045.jpg#1,A cat standing on top of a wooden bench.
000000397045.jpg#2,An orange cat sitting on top of a bench.
000000397045.jpg#3,An orange cat climbing up a green chair.
000000397045.jpg#4,A orange and white cat stands on a bench.
000000317173.jpg#0,A cat is sitting on the ground beside a wheel of a bicycle.
000000317173.jpg#1,A cat laying on a floor with it's arms wrapped around a shoe.
000000317173.jpg#2,A cat sitting cautiously over a pair of shoes on the floor.
000000317173.jpg#3,A cat is holding a shoe between his paws.
000000317173.jpg#4,A cat that is laying on the floor.
000000314537.jpg#0,A cat holding a toothbrush in its paw and chewing on it.
000000314537.jpg#1,A cat that is chewing on a toothbrush.
000000314537.jpg#2,a fuzzy white cat brushing its teeth with a toothbrush
000000314537.jpg#3,A cat with a tooth brush in it's mouth.
000000314537.jpg#4,A fluffy cat is has a toothbrush in it's mouth.
000000055630.jpg#0,An orange and white cat playing in a wood bowl
000000055630.jpg#1,A tabby cat is in a brown bowl on a table.
000000055630.jpg#2,A ginger cat playing inside a wooden bowl
000000055630.jpg#3,Small orange kitten sitting in a wooden bowl.
000000055630.jpg#4,An orange cat sitting in a wooden bowl.
000000228764.jpg#0,An orange and white cat standing on top of a beach.
000000228764.jpg#1,A cat looking at a dog on a beach.
000000228764.jpg#2,a cat that is looking at a dog
000000228764.jpg#3,A cat is sitting on the beach looking at a dog. 
000000228764.jpg#4,this stray cat watches a dog walk by on the beach
000000040348.jpg#0,"A brown, white and black cat sitting on top of a black suitcase."
000000040348.jpg#1,A cat sitting on top of a piece of luggage.
000000040348.jpg#2,Brown and white cat standing on top of a suitcase. 
000000040348.jpg#3,a black and brown cat sitting on the edge of a black suitcase
000000040348.jpg#4,a cat sitting on a chair in a living room
000000332485.jpg#0,A cat sitting directly on the keyboard of a laptop.
000000332485.jpg#1,A cat sitting on top of an open laptop computer.
000000332485.jpg#2,A cat that is perched directly over the keyboard of a laptop
000000332485.jpg#3,A grey cat sitting on the keyboard of a laptop.
000000332485.jpg#4,A grey cat is sitting on top of a laptop keyboard.
000000172163.jpg#0,A cat plays with a banana on a carpet.
000000172163.jpg#1,A cat lies on a rug and chews on a banana.
000000172163.jpg#2,a siamese cat laying on the floor with a toy banana
000000172163.jpg#3,A black and white cat is playing on the floor with a stuffed toy.
000000172163.jpg#4,A siamese cat playing with a toy on the floor.
000000282002.jpg#0,a cat laying on some clothes inside a suitcase
000000282002.jpg#1,A cat sitting on  a bag of luggage that is neatly packed.
000000282002.jpg#2,A cat sitting on top of a suitcase. 
000000282002.jpg#3,a cat laying on an open suitcase and looking at the camera
000000282002.jpg#4,The cat looks up from its position on top of the open suitcase.
000000104482.jpg#0,A cat peers out from underneath a comforter.
000000104482.jpg#1,The cat is peering out from a white blanket. 
000000104482.jpg#2,a grey and white cat in a white bed
000000104482.jpg#3,A kitten peeking out from of a pile of white blankets.
000000104482.jpg#4,a cat laying in some blankets on top of a bed
000000327146.jpg#0,A black and white cat sitting on a blue pillow on a wooden chair.
000000327146.jpg#1,A staring white and gray cat curled up in a wooden chair on a blue seat cushion. 
000000327146.jpg#2,A cat sitting on top of a chair.
000000327146.jpg#3,Cat resting on a chair cushion while staring above.
000000327146.jpg#4,The black and white cat is sitting on a chair cushion.
000000548511.jpg#0,A tiny stuffed bear sitting next to a cat
000000548511.jpg#1,A fuzzy white cat near a small toy bear.
000000548511.jpg#2,A very cute cat laying next to a small bear.
000000548511.jpg#3,A white cat with a small teddy bear next to it.
000000548511.jpg#4,A cat is sitting next to a small bear toy. 
000000556554.jpg#0,A cat sitting on top of a bowl with it's mouth open.
000000556554.jpg#1,"A long haired house cat, sitting in a shallow pot, is roaring."
000000556554.jpg#2,A cat hissing as it attempts to fit itself into a bowl that it is to big to fit in.
000000556554.jpg#3,A very hairy cat on a shelf showing it's teeth in a menacing way.
000000556554.jpg#4,A cat sitting in a pot with its mouth open.
000000388399.jpg#0,a cat lays on the ground playing with a toy 
000000388399.jpg#1,A tabby cat on a carpeted floor playing with a cat toy.
000000388399.jpg#2,A tabby cat on a carpet playing with a toy.
000000388399.jpg#3,A cat that is laying down on a carpet.
000000388399.jpg#4,a cat that is playing with some kind of mouse
000000370423.jpg#0,A white and gray dog sits on a bed near a pile of rumpled sheets.
000000370423.jpg#1,A gray and white dog sitting on a white mattress.
000000370423.jpg#2,A terrier sits on a messy bed in front of the window.
000000370423.jpg#3,A dog is sitting on a white sheeted bed while blankets lay frumpled alongside.
000000370423.jpg#4,A dog that is sitting on top of a bed.
000000040685.jpg#0,A cat is laying near a pillow on a bed. 
000000040685.jpg#1,A cat looks at the person taking the picture.
000000040685.jpg#2,a cat that is laying down on a bed
000000040685.jpg#3,a cat laying on a bed next to a wall. 
000000040685.jpg#4,A cat laying on a bed and looking up.
000000220777.jpg#0,A cat sniffs the end of a banana
000000220777.jpg#1,A tabby cat smelling the bit of a banana.
000000220777.jpg#2,A cat sniffing at a bananas stem end.
000000220777.jpg#3,A cat touches a banana with its nose.
