000000075309.jpg#0,A airplane with propellers that is flying in the sky.
000000075309.jpg#1,One old airplane flying high in the sky.
000000075309.jpg#2,An airplane is flying through a clear blue sky. 
000000075309.jpg#3,Looking up at a propeller airplane in a blue sky
000000075309.jpg#4,Small white propeller airplane flying through the sky. 
000000302886.jpg#0,An airplane is taking off into the sky. 
000000302886.jpg#1,The twin engine airline has it's landing gear down while in the air. 
000000302886.jpg#2,A airplane that is flying in the sky.
000000302886.jpg#3,A jet plane flies overhead against a cloudy backdrop. 
000000302886.jpg#4,An airplane during takeoff ascends into the clouds.
000000454018.jpg#0,Looking down on snow capped mountains from an airplane window
000000454018.jpg#1,Snow capped mountains are seen from the airplane.
000000454018.jpg#2,Looking at the airplane wing and the ground below.
000000454018.jpg#3,a wing of a airplane that is flying through the sky
000000454018.jpg#4,A view from very high up in a plane looking down.
000000151347.jpg#0,A large passenger jet flying over a mountain.
000000151347.jpg#1,"Yellow, white and blue airplane flying over a mountain."
000000151347.jpg#2,An airplane is flying over a huge mountain covered with snow.
000000151347.jpg#3,A plane is flying over a snowy mountain.
000000151347.jpg#4,An airplane flying in the sky over a snowy mountain.
000000119232.jpg#0,The sleek fighter jet is flying sideways through the air. 
000000119232.jpg#1,A fighter jet in the air against a white sky.
000000119232.jpg#2,A jet that is flying in the sky.
000000119232.jpg#3,a close up of a jet flying thru the sky
000000119232.jpg#4,A fighter plant performing manueverin in the air
000000097754.jpg#0,a white blue and red jet against a blue sky
000000097754.jpg#1,A photo of US Airways airplane in the sky.
000000097754.jpg#2,A large white jetliner flying through a blue sky.
000000097754.jpg#3,A US Airways plane in the air flying upward in the sky.
000000097754.jpg#4,a long airplane taking off in the sky
000000164944.jpg#0,a photo of the back of an aircraft parked in  front of a hangar
000000164944.jpg#1,A jet sitting on top of an airport tarmac.
000000164944.jpg#2,a big plane sits parked in front of a building 
000000164944.jpg#3,The airplane is sitting by the building outside. 
000000164944.jpg#4,The backside of a plane at the airport.
000000311641.jpg#0,Large airplane flying over the sky towards a mysterious area.
000000311641.jpg#1,a plane flying in the air over some trees 
000000311641.jpg#2,An airplane is flying by the fluffy white clouds.
000000311641.jpg#3,A passenger jet airplane flying through a cloudy sky above a couple of trees.
000000311641.jpg#4,An airplane flying under the clouds in daytime.
000000134334.jpg#0,A small blue and white plane is on the runway.
000000134334.jpg#1,The small airplane was on the runway with it's propeller spinning.
000000134334.jpg#2,A small propeller plane sits on the tarmac adjacent to a field. 
000000134334.jpg#3,A blue and white small plane on the runway in an airport with many trees in the background.
000000134334.jpg#4,A small white passenger plane on a runway.
000000333371.jpg#0,A four engine Air Algerie prop plane with landing gear out
000000333371.jpg#1,A large airplane flying through a cloudy sky.
000000333371.jpg#2,The huge jumbo jet has two engines on each wing as it flies.
000000333371.jpg#3,A plane while in flight in the air. 
000000333371.jpg#4,An Air Algerie plane in the air on a partly cloudy day
000000484122.jpg#0,A view of a snow-covered mountain from the air. 
000000484122.jpg#1,An overhead view of snow capped mountains and the valley alongside them.
000000484122.jpg#2,View of mountains looking out the window of a plane.
000000484122.jpg#3,A is picture taken looking down on mountains from an airplane.
000000484122.jpg#4,The wing of an airplane as they fly over mountains.
000000371091.jpg#0,A white and grey jet airliner flying in blue sky.
000000371091.jpg#1,This airplane is decorated with blue and red paint.
000000371091.jpg#2,a photo of a big passenger airplane taken from ground level
000000371091.jpg#3,A commercial jet airliner in the sky with its landing gear down.
000000371091.jpg#4,"An white, blue and red commercial airplane flying in the sky."
000000187844.jpg#0,A small airplane on the runway getting ready to take off.
000000187844.jpg#1,a large air plane on a run way
000000187844.jpg#2,A plane seems to have just landed from the sky. 
000000187844.jpg#3,A plane is sitting on a landing strip.
000000187844.jpg#4,A plane on a snowy airstrip that is taking off.
000000476993.jpg#0,A close up of a single engine plane on the tarmac.
000000476993.jpg#1,"A small white, orange and red plane rests in an airport."
000000476993.jpg#2,A small airplane with a propeller at the airport. 
000000476993.jpg#3,A small red and white plane sits on a runway.
000000476993.jpg#4,A small airplane sitting on top of an airport runway.
000000316474.jpg#0,A airplane in the show by a forest
000000316474.jpg#1,The airplane is on the ground of the snowy field.
000000316474.jpg#2,An airplane sits idle on a snowy tarmac.
000000316474.jpg#3,A scrapped airplane sits in snow with a ramp leading into the back end.
000000316474.jpg#4,The back end of a damaged Canadian air liner
000000011525.jpg#0,A metal plane flying through a blue cloudy sky.
000000011525.jpg#1,a large air plane flying in the sky
000000011525.jpg#2,An aeroplane is soaring high in the sky.
000000011525.jpg#3,Small aircraft flying at a steep angle in a blue sky
000000011525.jpg#4,A grey plane flying in clear blue skies.
000000512310.jpg#0,A large jetliner sitting on top of a runway.
000000512310.jpg#1,A commercial air plane taking off from a runway.
000000512310.jpg#2,An airplane sits on the tarmac at sunset
000000512310.jpg#3,a airplane that has landed on a a landing runway 
000000512310.jpg#4,An airplane with four engines is on a runway. 
000000376128.jpg#0,there is a very large plane taking off from the airport
000000376128.jpg#1,A airplane that is sitting on a runway.
000000376128.jpg#2,A plane is landing on a runway in the middle of the afternoon.
000000376128.jpg#3,A commercial airplane on the runway with the jets on.
000000376128.jpg#4,A large jetliner landing on top of a runway.
000000381274.jpg#0,The plane is flying high in the sky.
000000381274.jpg#1,A black and red plane flying through the sky. 
000000381274.jpg#2,An airplane flying across the clear blue sky.
000000381274.jpg#3,A blue and white airplane is flying in the sky
000000381274.jpg#4,A blue and white jet plane flies in the blue sky.
000000091508.jpg#0,An blue and white airliner is flying through the air.
000000091508.jpg#1,A large airplane flying in a clear blue sky.
000000091508.jpg#2,A large white and blue airplane flying through a blue sky.
000000091508.jpg#3,a large airplane that is descending for landing. 
000000091508.jpg#4,A large commercial jet flying through blue sky
000000480605.jpg#0,An airplane flies up into the sky with the wheel out.
000000480605.jpg#1,the bottom side of an air plane on take off
000000480605.jpg#2,a large air plane flying thru the air
000000480605.jpg#3,A white jet airliner with blue sky in background.
000000480605.jpg#4,A commercial airplane flying through the sky during the day.
000000157021.jpg#0,A large jet flying through a gray sky with four engines.
000000157021.jpg#1,A large gray airplane flying in the sky. 
000000157021.jpg#2,A large plane is flying through the air
000000157021.jpg#3,The very large cargo plane has four turbine engines.
000000157021.jpg#4,A large cargo jet flying through the sky.
000000032093.jpg#0,And airplane driving on an airstrip at an airport.
000000032093.jpg#1,A large jet waiting on a runway for take off. 
000000032093.jpg#2,A red and white airplane prepares to take off
000000032093.jpg#3,A red nosed air plane sitting on the tarmac.
000000032093.jpg#4,A white and red airplane on an airport's runway.
000000401783.jpg#0,A view of the mountains is shown from an airplane window.
000000401783.jpg#1,You can see a long way in the plane.
000000401783.jpg#2,WING OF AN AIRPLANE SHOWN FLYING OVER THE MOUNTAINS
000000401783.jpg#3,The view from an airplane window over mountains
000000401783.jpg#4,A picture of a plane that is in the air around the mountains.
000000040485.jpg#0,The single propelleor airplane slowly takes off from the airport.
000000040485.jpg#1,A airplane that has a propeller on it.
000000040485.jpg#2,An old dark blue airplane taking off near a house.
000000040485.jpg#3,A small plane with a black and yellow propeller.
000000040485.jpg#4,a black and yellow airplane flying and some trees
000000096211.jpg#0,a dark blue jet with a red and white stripe is flying
000000096211.jpg#1,A big passenger plane flying through the sky.
000000096211.jpg#2,A US Airways Express airplane flying high in the sky. 
000000096211.jpg#3,A commercial airliner in flight under clear blue skies.
000000096211.jpg#4,A large passenger jet flying through a bright blue sky.
000000570349.jpg#0,"BLACK, BLUE, WHITE, RED, ORANGE RED AND YELLOW AIRPLANE"
000000570349.jpg#1,A picture of a colorful plane flying in the sky. 
000000570349.jpg#2,A multi-colored airplane makes its way through the blue sky.
000000570349.jpg#3,Shot of bottom side of jet flying against a blue sky
000000570349.jpg#4,"A plane flies over, painted in right colors. "
000000482734.jpg#0,a small air plane on a run way
000000482734.jpg#1,A modern plane sitting idle in a hangar
000000482734.jpg#2,A passenger private jet at an airport just touching down
000000482734.jpg#3,an airplane rests on the air strip 
000000482734.jpg#4,a small commuter jet sits on a run way 
000000370550.jpg#0,An airplane is flying in a clear sky.
000000370550.jpg#1,A jet flying across a blue sky. 
000000370550.jpg#2,An airplane in the sky with landing gear down.
000000370550.jpg#3,An airplane is flying in the blue sky. 
000000370550.jpg#4,Looking up at a jet airliner coming in to land
000000305569.jpg#0,A jumbo jet airplane carrying a space shuttle in the air.
000000305569.jpg#1,A large jet with a space shuttle attached to it's back.
000000305569.jpg#2,A space ship from NASA being transported by plane.
000000305569.jpg#3,A plane that is flying in the sky.
000000305569.jpg#4,A jet plane that is carrying the space shuttle on top of it. 
000000245202.jpg#0,A large jet airplane during landing at an airport.
000000245202.jpg#1,a blue and white plane sitting in the grass 
000000245202.jpg#2,A blue KLM jet touches down on a runway
000000245202.jpg#3,"A KLM plane lands on a runway on a clear day,"
000000245202.jpg#4,An airplane is landing on an airport landing strip.
000000066858.jpg#0,The underside of a plane flying in the sky
000000066858.jpg#1,A flying USAF jet seen from below in a blue sky
000000066858.jpg#2,A large jetliner flying through a blue sky.
000000066858.jpg#3,The under side of an airplane in flight
000000066858.jpg#4,A jet plane flying over head  in a clear blue sky.
000000416869.jpg#0,This British United passenger plane is taking off
000000416869.jpg#1,Propeller airliner almost touching down on a runway.
000000416869.jpg#2,a large plane is taking off from a runway
000000416869.jpg#3,A British United cargo plane landing at in a grassy area.
000000416869.jpg#4,A passenger plane that is flying low to the ground.
000000018601.jpg#0,A massive mountain covered in snow behind a red airplane wing.
000000018601.jpg#1,View of several snow covered mountain peaks taken from a plane with red wings.
000000018601.jpg#2,A snow covered mountain top next to a red metal platform.
000000018601.jpg#3,A snow capped peak of a rocky mountain.
000000018601.jpg#4,The view from a plane passing a mountain.
000000067608.jpg#0,A large jet flying through a cloudy blue sky.
000000067608.jpg#1,A airplane that is flying in the sky.
000000067608.jpg#2,A plane on the rise into a part of the sky that is blue with white and dark clouds.
000000067608.jpg#3,a gray jet is flying in a blue sky with clouds
000000067608.jpg#4,A passenger jet airplane flying in a mostly cloudy sky.
000000532333.jpg#0,A small plane parked in an airport hangar.
000000532333.jpg#1,A small prop plane parked in a hangar.
000000532333.jpg#2,A plane sitting in an airport hanger building
000000532333.jpg#3,An old metal airplane parked in a hanger
000000532333.jpg#4,A white antique plane parked in an airplane hanger with a medical cross on it.
000000043678.jpg#0,A very large commercial plane flying in blue skies.
000000043678.jpg#1,an airplane taking off in the blue sky
000000043678.jpg#2,The white flight flying in the sky and it about to land
000000043678.jpg#3,A plane flying in a clear blue sky.
000000043678.jpg#4,a large air plane flying in the air
000000208329.jpg#0,A black and white photo of the back of a large plane.
000000208329.jpg#1,A large jet at an airport runway. 
000000208329.jpg#2,A large airplane sitting on top of an airport runway.
000000208329.jpg#3,The back end of a plane's tail section on the tarmac of an airport.
000000208329.jpg#4,Black and white photograph of the back of a jet airliner.
000000164487.jpg#0,A plane that has landed in an airport. 
000000164487.jpg#1,A medium sized airplane is parked on the tarmac. 
000000164487.jpg#2,a large air olane on a run way
000000164487.jpg#3,An airplane sitting on top of an airport tarmac.
000000164487.jpg#4,The large propeller plane is setting on the tarmac.
000000194862.jpg#0,An airplane is flying with its wheels down.
000000194862.jpg#1,The back of an airplane flying in the air. 
000000194862.jpg#2,The airplane just took off from the runway at the airport. 
000000194862.jpg#3,An airplane flying through a sky with it's landing gear down.
000000194862.jpg#4,The view from behind of a flying airplane.
000000551214.jpg#0,A large jetliner flying through a  blue cloudy sky.
000000551214.jpg#1,a blue and white jet flying in a blue sky
000000551214.jpg#2,"An airplane with the landing gear deployed, flying in the sky."
000000551214.jpg#3,A very large commercial plane flying in blue skies.
000000551214.jpg#4,A white airplane with a polka-dotted tail fin in the air. 
000000528069.jpg#0,A distant view from high up in the sky in a window.
000000528069.jpg#1,Looking out from a jet plane over the mountains.
000000528069.jpg#2,A view from an airplane of mountains with a partial snow-cap 
000000528069.jpg#3,A view outside of an airplane window of a wing over a mountain range.
000000528069.jpg#4,A wing view of a plane overlooking a mountain area.
000000254710.jpg#0,The large plane is sitting in the middle of the runway. 
000000254710.jpg#1,A twin engine plane goes down the runway.
000000254710.jpg#2,A large plane is sitting on the runway preparing for takeoff.
000000254710.jpg#3,A plane is on the runway at an airport.
000000254710.jpg#4,A colorful passenger airplane on a concrete runway.
000000549011.jpg#0,"A white and red plane with a caption reading ""avlon."""
000000549011.jpg#1,An airplane photographed in a hangar with the text avlon printed below it.
000000549011.jpg#2,The small airplane is parked inside the garage. 
000000549011.jpg#3,A small single engine aircraft parked in a garage.
000000549011.jpg#4,A small plane that is parked in a hanger. 
000000435777.jpg#0,A small passenger jet flying through a blue sky.
000000435777.jpg#1,A large jet plane flying in the sky
000000435777.jpg#2,A small jet coming in for a landing.
000000435777.jpg#3,An airplane with the landing gear deployed in the sky.
000000435777.jpg#4,THERE IS A PRIVATE JET COMING IN FOR LANDING 
000000254729.jpg#0,An angled airplane wing is seen over a snowy mountain range.
000000254729.jpg#1,A picture of a plane in the air.
000000254729.jpg#2,A snow-capped mountain seen from a plane window.
000000254729.jpg#3,A view of a snowy mountain from an airplane.
000000254729.jpg#4,A jetliner flying over a mountain covered in white fluffy snow.
000000253557.jpg#0,Red and white plane sitting in a green field.
000000253557.jpg#1,A small plane parked on top of a lush green field.
000000253557.jpg#2,a red black and white airplane parked on a grass field
000000253557.jpg#3,A white and red aircraft is sitting in the grass.
000000253557.jpg#4,It's necessary to tie down a light airplane so it won't be tossed by the wind.
000000171637.jpg#0,An airplane is soaring high in a cloudless sky.
000000171637.jpg#1,A jumbo jet passenger aircraft in flight with landing gear down.
000000171637.jpg#2,A large airplane is flying in the sky. 
000000171637.jpg#3,A Delta jet in the sky with landing gear deployed.
000000171637.jpg#4,a large jet airplane flying in the sky
000000001029.jpg#0,A large jet flying through a cloudy sky.
000000001029.jpg#1,Some barbed wire up close and an airplane taking off.
000000001029.jpg#2,A airplane flies into the clouds with a barbed wire fence in the foreground.
000000001029.jpg#3,An airplane is shown taking off into the sky.
000000001029.jpg#4,a plane flying high in the sky on a cloudy day
000000168200.jpg#0,Commercial jet airplane flying in clear blue skies.
000000168200.jpg#1,This blue and white airplane is soaring through clear skies.
000000168200.jpg#2,the plane is flying. The bottom is blue
000000168200.jpg#3,View of overhead jet plane on landing approach.
000000168200.jpg#4,A jet flying overhead appears to be coming in for a landing.
000000377493.jpg#0,The plane is flying past the yellow tower. 
000000377493.jpg#1,a large plane prepares to land at the airport.
000000377493.jpg#2,A large commercial airplane is flying in the blue sky.
000000377493.jpg#3,A large jetliner flying udner a cloudy sky.
000000377493.jpg#4,A passenger jet that is flying in the sky.
000000041276.jpg#0,A small airplane is flying against the blue sky.
000000041276.jpg#1,A big shiny metal plane flying in blue skies.
000000041276.jpg#2,THERE IS AN AIR PLANE IN THE SKY 
000000041276.jpg#3,A propeller plane that is flying in the sky.
000000041276.jpg#4,An airplane is flying in the clear sky.
000000272736.jpg#0,A plane flies high in the middle of a dark sky.
000000272736.jpg#1,A distant airplane flying high up in the sky.
000000272736.jpg#2,An airplane is flying low in a cloudy sky.
000000272736.jpg#3,a large jet airplane high in the sky
000000272736.jpg#4,A airplane that is in the sky near clouds.
000000277403.jpg#0,A large commercial air plane fling in front of a vortex of clouds.
000000277403.jpg#1,A huge commerical airplane roaring through the clouds.
000000277403.jpg#2,I am unable to see an image above.
000000277403.jpg#3,A airplane with two engines on each wing flying ahead with a tunnel shape cloud behind it.
000000277403.jpg#4,Gray airplane flying in front of unusual cloud formation.
000000287049.jpg#0,An airplane flies through the air during twilight.
000000287049.jpg#1,A white and blue airplane in flight with landing gear out.
000000287049.jpg#2,A large jetliner flying through a cloudy sky.
000000287049.jpg#3,"An airplane that has either just taken off or is about to land, since the flaps are out."
000000287049.jpg#4,The orange and black plane is flying high in the sky.
000000557660.jpg#0,A two engined passenger aircraft flying up in the sky.
000000557660.jpg#1,A large jet flying through a blue cloudy sky.
000000557660.jpg#2,An airplane is flying high in a blue sky.
000000557660.jpg#3,A large airplane flies against a blue sky.
000000557660.jpg#4,An airplane flying in the big blue sky with no clouds
000000278489.jpg#0,A passenger jumbo jet taxiing at an airport.
000000278489.jpg#1,A plane sitting on a tarmac on an airport
000000278489.jpg#2,A large white airplane parked in a stationary position.
000000278489.jpg#3,An airplane on the concrete under a cloudy blue sky.
000000278489.jpg#4,There is a large plane sitting on a runway.
000000009426.jpg#0,A small plane flying through a cloudy blue sky.
000000009426.jpg#1,Red and white small plane on partially cloudy day.
000000009426.jpg#2,"A red and white biplane in a blue, cloudy sky."
000000009426.jpg#3,A plane that is flying in the air.
000000009426.jpg#4,A small lightweight airplane flying through the sky.
000000011474.jpg#0,A white and blue plane sitting on a run way.
000000011474.jpg#1,A jet blue airplane is on a runway by water.
000000011474.jpg#2,a large air plane on an air port run way
000000011474.jpg#3,A jet blue air plane going down the runway at an airport.
000000011474.jpg#4,a white and blue jet is on a runway at an airport
000000567053.jpg#0,a plane is parked on a asphalt ready to fly
000000567053.jpg#1,a propeller plane sits parked in a parking lot 
000000567053.jpg#2,A small plane parked on a runway near a forest
000000567053.jpg#3,A small flier plane sits in a parking lot.
000000567053.jpg#4,A small white and blue plane sitting on black top.
000000010627.jpg#0,a airplane flying through a clear blue sky.
000000010627.jpg#1,A large airplane flying over a dessert field.
000000010627.jpg#2,Military airplane flying low over barren ground against a slightly cloudy sky.
000000010627.jpg#3,A plane flying over a large field with rolling hills. 
000000010627.jpg#4,A military style airplane flying over the desert.
000000477029.jpg#0,A yellow plane with one propeller and numbers on the side of it.
000000477029.jpg#1,a classic fighter plane sits in a hangar 
000000477029.jpg#2,An old yellow fighter plane is in a hangar.
000000477029.jpg#3,A hazard yellow Navy plane sits in a hangar.
000000477029.jpg#4,A small yellow plane is parked in the hangar.
000000512895.jpg#0,A white plane with a blue tail flying in a blue sky.
000000512895.jpg#1,This is an airplane flying in the sky.
000000512895.jpg#2,An airplane begins its ascent in to the sky.
000000512895.jpg#3,An airplane is up in the wide open spaces with fluffy clouds.
000000512895.jpg#4,An airplane flying thru the air in overcast skies
000000560629.jpg#0,An air force air plane on a runway.
000000560629.jpg#1,A large air force jet taking off from a runway.
000000560629.jpg#2,A large U.S. air force plane sitting on the tarmac.
000000560629.jpg#3,A gray air force airplane is on the runway.
000000560629.jpg#4,A large military plane sitting on a runway
000000000081.jpg#0,A big airplane flying in the big blue sky
000000000081.jpg#1,"Large, two decked, four engined airliner in flight."
000000000081.jpg#2,An AirFrance jet airplane flying in the sky 
000000000081.jpg#3,A big plane with AirFrance on the side of it.
000000000081.jpg#4,An Air France air plane in mid flight.
000000164222.jpg#0,A small plane flying through a gray sky.
000000164222.jpg#1,Black and white photograph of a light aircraft in flight
000000164222.jpg#2,A small passenger airplane flying high in the sky.
000000164222.jpg#3,A white plane flying through a cloudy sky.
000000164222.jpg#4,A cargo plane flying above in the sky
000000194722.jpg#0,A plane flying over the water off the coast
000000194722.jpg#1,Biplane flying over blue ocean next to coastline.
000000194722.jpg#2,A small airplane flying over the ocean during the day.
000000194722.jpg#3,A biplane is flying over a rocky shore line.
000000194722.jpg#4,The plane is flying over the ocean in clear skies.
000000197226.jpg#0,An airplane landing at a new airport. 
000000197226.jpg#1,An airplane flying over a light pole in the air.
000000197226.jpg#2,this airplan is flying on a clear day
000000197226.jpg#3,a plane flies below a cloudless blue sky
000000197226.jpg#4,An airplane flying overhead with the wheels down
000000187557.jpg#0,An impressive looking blue and gold plain waiting on a runway
000000187557.jpg#1,A blue and gold fighter yet is sitting on a runway.
000000187557.jpg#2,A plane is painted many colors and traveling on the runway.
000000187557.jpg#3,A large blue jet is sitting on a runway
000000187557.jpg#4,A jet plane sitting on a runway under a cloudy sky.
000000024790.jpg#0,A plane has its wings folded up towards the body.
000000024790.jpg#1,A blue and yellow plane with folding wings on a runway.
000000024790.jpg#2,The older airplane is about ready to take off from the runway. 
000000024790.jpg#3,Plane parked out on the runway with it's wings folded up
000000024790.jpg#4,A prop plane with is movable wings folded up parked on a runway.
000000421682.jpg#0,The moon in the sky above a jetliner.
000000421682.jpg#1,jet airliner in the sky with a half visible moon in the background
000000421682.jpg#2,A jumbo jet plane flying below a view of the moon.
000000421682.jpg#3,An airplane flying through the sky with a half moon visible above it.
000000421682.jpg#4,The plane is flying high in the sky and the moon is fading in the background.
000000327539.jpg#0,A small silver airplane parked on an airport.
000000327539.jpg#1,A propeller plane is secured with blocks on the tarmac.
000000327539.jpg#2,A vintage airplane on the runway on a cloudy day.
000000327539.jpg#3,An airplane is sitting on an empty runway. 
000000327539.jpg#4,A silver air craft is parked on the tarmac.
000000237427.jpg#0,A small airplane flying high up in the sky.
000000237427.jpg#1,Black and white photograph of a plane flying over a field.
000000237427.jpg#2,An older airplane flying above buildings and fields.
000000237427.jpg#3,A black and white photo of an airplane flying through the sky.
000000237427.jpg#4,An airplane is flying low over the ocean.
000000242153.jpg#0,A plane that has a tear in the side of it.
000000242153.jpg#1,Looking up at the damaged side of a Canadian jet airplane
000000242153.jpg#2,The side of a Canadian airplane has a damaged section.
000000242153.jpg#3,Out of commission jet from the country canada 
000000242153.jpg#4,a close up of an air plane near a tree 
000000510942.jpg#0,A small black airplane sitting on top of a runway.
000000510942.jpg#1,A prop plane spins up it's propeller for take off.
000000510942.jpg#2,"A small plane on a runway, taking off."
000000510942.jpg#3,An old military plane on a runway with wings folded.
000000510942.jpg#4,an image of a broken fighter plane on the runway
