000000187280.jpg#2,"An intersection shows a building on one side and two doubledecker buses and a third vehicle, pulling up to a crosswalk, before a side road.    "
000000187280.jpg#3,A red double decker bus driving down a city street.
000000187280.jpg#4,there is a double decker red bus coming up the street 
000000454253.jpg#0,A street scene of a crosswalk and cars in the background.
000000454253.jpg#1,A pedestrian crossing sign placed next to a crosswalk.
000000454253.jpg#2,"A one way street with cars parked, lined with buildings and brick sidewalks."
000000454253.jpg#3,it is a rainy day and not many people are outside
000000454253.jpg#4,A crosswalk warning sign on a cobblestone walk that is wet from rain.
000000061729.jpg#0,A street in front of an apartment building in winter.
000000061729.jpg#1,A street at night when the sky is very dark.
000000061729.jpg#2,A street lined with apartment buildings with dusting of snow.
000000061729.jpg#3,A street sign and some cars on a road.
000000061729.jpg#4,a woman stands under an umbrella near a street sign
000000231368.jpg#0,A white van is following an orange and white bus down the road. 
000000231368.jpg#1,A van following behind a bus in the street. 
000000231368.jpg#2,A white and orange bus driving down a city street.
000000231368.jpg#3,A van follows behind a bus on a rural road.
000000231368.jpg#4,A passenger bus that is driving down a street.
000000472041.jpg#0,a car is parked on the side of the street
000000472041.jpg#1,some cars parked on the side of the road 
000000472041.jpg#2,a parking meter on a rural street and a parked car
000000472041.jpg#3,a vehicle is parked against a curb with a meter
000000472041.jpg#4,A car parked beside and a sidewalk and parking meter.
000000377592.jpg#0,A red stop sign sitting on the side of a road.
000000377592.jpg#1,A stop sign in a foreign country 
000000377592.jpg#2,A stop sign with English and Chinese writing under an elevated road.
000000377592.jpg#3,A red stop sign located in a parking garage. 
000000377592.jpg#4,A stop sign under a bridge on a Korean roadway.
000000374490.jpg#0,A view of a busy intersection with traffic through a vehicles windshield.
000000374490.jpg#1,a person riding a motorcycle on a city street
000000374490.jpg#2,Looking out the windscreen at the traffic at an intersection
000000374490.jpg#3,A person on a bike on a city street.
000000374490.jpg#4,A man riding a motorcycle across a street.
000000445371.jpg#0,A brown dog tied up to a brown wooden bench next to a street.
000000445371.jpg#1,The hog is tethered to the city's park bench.
000000445371.jpg#2,A tan dog is tied to a bench on the sidewalk of a small town street.
000000445371.jpg#3,an image of a dog on a leash near a bench
000000445371.jpg#4,A dog is tied to an empty bench by its leash.
000000333463.jpg#0,A parking meter with garland on it near a curb and a parked car.
000000333463.jpg#1,There is festive tinsel decorating the parking meter.
000000333463.jpg#2,this is a parking meter with a ribbon around it
000000333463.jpg#3,A couple of cars parked in front of a parking meter.
000000333463.jpg#4, a line of cars parked in the street next to a curb
000000352938.jpg#0,there are many busses coming along this street
000000352938.jpg#1,a line of buses that are parked in the road
000000352938.jpg#2,city buses are parked and traveling down the street
000000352938.jpg#3,a couple of buses are parked by a building
000000352938.jpg#4,A row of parked buses sitting in a  parking lot.
000000047293.jpg#0,A photo looking at a car mirror at the traffic behind.
000000047293.jpg#1,A car mirror looking back at mountains and traffic
000000047293.jpg#2,Looking in the rear-view mirror of a car travelling on the interstate.
000000047293.jpg#3,A driver looking at traffic through the rearview mirror of a car.
000000047293.jpg#4,A rear view mirror on the side of a car reflecting a mountain range.
000000171915.jpg#0,Two red buses are passing on the street.
000000171915.jpg#1,A bus pulls up to a stop with people at it.
000000171915.jpg#2,Two buses at bus stop with people on sidewalk
000000171915.jpg#3,a public transit bus on a city street
000000171915.jpg#4,Passengers walking to a bus pulled up to a bus stop.
000000218134.jpg#0,"A white, red and blue bus on street next to people walking."
000000218134.jpg#1,A large white bus is traveling through the city streets.
000000218134.jpg#2,A pink and white bus is going down the street.
000000218134.jpg#3,A city bus in a downtown area heating to Baliaffray.
000000218134.jpg#4,A bus driving across a parking lot with waiting passengers.
000000012230.jpg#0,A car and a van parked side by side.
000000012230.jpg#1,two cars parked next to each other in a parking lot.
000000012230.jpg#2,some cars parked in a parking lot next to a sign
000000012230.jpg#3,Two cars parked in a lot with buildings in the background.
000000012230.jpg#4,The birds are resting on the roofs of the cars in the parking lot.
000000281160.jpg#0,Street directional signage displayed at intersection in city.
000000281160.jpg#1,The street sign shows which directions are east and west.
000000281160.jpg#2,A street sign on a corner written in another language
000000281160.jpg#3,A sign post of Xing'an Road points out East and West.
000000281160.jpg#4,A road sign is in the foreground with a street corner in the background.
000000496045.jpg#0,A yellow and red double decker bus sitting on top of a street.
000000496045.jpg#1,A double decker bus is driving around the corner of a street.
000000496045.jpg#2,a red and tan double decker bus a street and a street light
000000496045.jpg#3,a red and yellow double decker bus on city street
000000496045.jpg#4,"A double decker bus making a turn, crossing into the other lane."
000000289740.jpg#0,A man loading luggage in the back of an SUV.
000000289740.jpg#1,A man is putting luggage into the back of a van.
000000289740.jpg#2,A man putting luggageinto the back of a mini van.
000000289740.jpg#3,"A man is kneeling on the asphalt to push a piece of luggage into the storage area of an SUV already full of luggage, while another person, of whom we can only see an arm and a side, stands by. "
000000289740.jpg#4,A man keeps a suitcase from falling out of a vehicle.
000000094420.jpg#0,A man waiting for oncoming traffic to pass so he can cross the street. 
000000094420.jpg#1,a man standing by a street light waiting for a bus.
000000094420.jpg#2,A red bus is on the street by a stop light.
000000094420.jpg#3,A man waits at a crosswalk as a bus passes.
000000094420.jpg#4,A bus is preparing to pick up passengers at a bus stop.
000000365611.jpg#0,Multiple lane road in large city on sunny day.
000000365611.jpg#1,A view up hill of a busy city street.
000000365611.jpg#2,The traffick signal is showing a red light. 
000000365611.jpg#3,A crosswalk on a city street with cars and buildings in the background.
000000365611.jpg#4,A red traffic light and a crosswalk in an industrial city. 
000000567935.jpg#0,a white clock tower with two white clocks and cars
000000567935.jpg#1,"City city at night complete with a blue sky, buildings and a white tower type building."
000000567935.jpg#2,A well lit clock tower next to a busy street
000000567935.jpg#3,A town with a cars driving around with buildings around the road.
000000567935.jpg#4,a large clock tower in a city near buildings
000000263101.jpg#0,A train going down the tracks in a city. 
000000263101.jpg#1,A light rail train is traveling on a track on the street.
000000263101.jpg#2,A trolly is coming down the tracks next to a sidewalk with people walking.
000000263101.jpg#3,A trolley train is close to houses on it's tracks.
000000263101.jpg#4,"A train is passing through a residential area with houses, trees, cars and pedestrians.  "
000000133999.jpg#0,A double decker bus driving down a street next to a tall building.
000000133999.jpg#1,busy street with two buses and cars 
000000133999.jpg#2,two public transit buses on a city street
000000133999.jpg#3,A group of buses driving down a city street
000000133999.jpg#4,An intersection with two buses and a car
000000451594.jpg#0,A double decker city bus driving down the street
000000451594.jpg#1,A double decker bus waits at a bus stop.
000000451594.jpg#2,A large double decker bus driving down a city street.
000000451594.jpg#3,A double decker bus parked on the street.
000000451594.jpg#4,A double decker bus going down the street.
000000480872.jpg#0,A city street filled with traffic driving past a tall building.
000000480872.jpg#1,A row of cars riding on a street with transit buses behind them.
000000480872.jpg#2,A car passing a bus on a city street
000000480872.jpg#3,A small turns a corner on a street.
000000480872.jpg#4,Mini smart cars making a convoy and driving through city.
000000068912.jpg#0,A group of people standing around a street next to buildings.
000000068912.jpg#1,A narrow paved street with pedestrians lined with two story houses.
000000068912.jpg#2,some people walking down the road with one on them holding a surfboard 
000000068912.jpg#3,a group of friends are walking down a small street
000000068912.jpg#4,a couple of people are walking around a city  street
000000408818.jpg#0,A red caboose with a man hanging off the back of it.
000000408818.jpg#1,A red train at a station with people inside and a conductor standing on the front. 
000000408818.jpg#2,A man stands at the back of a train coach with others seated inside
000000408818.jpg#3,A group of people riding on a train.
000000408818.jpg#4,A peerson standing on the end of a trolley.
000000022440.jpg#0,A red bus traveling down a street next to parked cards.
000000022440.jpg#1,A red passenger bus moving between parked cars in the street.
000000022440.jpg#2,Red Liverpool Street bus driving down a city street.
000000022440.jpg#3,A red bus is going down a city street.
000000022440.jpg#4,A city bus driving down a city street
000000379448.jpg#0,A traffic light suspended above a city street.
000000379448.jpg#1,A traffic light hanging on a line over a road.
000000379448.jpg#2,An city street at night with a traffic light. 
000000379448.jpg#3,I am unable to see an image above.
000000379448.jpg#4,A streak of light is shining down a street.
000000516167.jpg#0,a red pick up truck is parked outside 
000000516167.jpg#1,An old maroon pickup truck is standing in the park in lot as the sun beams down. 
000000516167.jpg#2,a truck sits parked next to some other cars 
000000516167.jpg#3,A truck parked near another car and the sidewalk. 
000000516167.jpg#4,a pick up truck parked next to a side walk with other cars parked in the back ground
000000118787.jpg#0,Cars waiting at a stoplight at night with city lights in background.
000000118787.jpg#1,A bunch of vehicles that are sitting in the street.
000000118787.jpg#2,Traffic of cars on the street in the city at night time.  
000000118787.jpg#3,A city street at night filled with lots of traffic.
000000118787.jpg#4,a busy street that  has a lot of cars in it
000000105936.jpg#0,The woman is getting ready to cross the street in the city. 
000000105936.jpg#1,A woman in blue jeans and a long sleeve shirt waiting on a street corner.
000000105936.jpg#2,A woman standing at a street corner as a man approaches her fom across the way.
000000105936.jpg#3,A man and a woman are crossing the street in the city. 
000000105936.jpg#4,A man and woman use a crosswalk in a city.
000000012891.jpg#0,A railroad train traveling along a flower lined street
000000012891.jpg#1,A train is moving along the tracks beside a path.
000000012891.jpg#2,A people walking on a paved path next to a railroad track.
000000012891.jpg#3,People strolling along a cherry blossom covered pathway by a busy railway line
000000012891.jpg#4,A train engine carrying carts down a track.
000000169026.jpg#0,"Cars and a passenger bus drive down a dirty, slushy street. "
000000169026.jpg#1,A bus is going down the street in the snow.
000000169026.jpg#2,A bus driving down a snow covered street.
000000169026.jpg#3,a yellow and a white bus some snow a car and buildings
000000169026.jpg#4,a bus is driving down a snowy city street.
000000431152.jpg#0,People walking down a residential street where cars are parked.
000000431152.jpg#1,Pedestrians and parked cars on a small village street
000000431152.jpg#2,Cars parked in the street of a town.
000000431152.jpg#3,Cars are parked on a street near people walking.
000000431152.jpg#4,A street filled with traffic next to tall buildings.
000000531844.jpg#0,A city buss driving down a quiet street. 
000000531844.jpg#1,A bus driving down a street next to a tall building.
000000531844.jpg#2,"A city bus driving down a street, past a store."
000000531844.jpg#3,A bus travelling pass a store and parked cars. 
000000531844.jpg#4,a red white and yellow bus some buildings and cars
000000390935.jpg#0,People are in a desert with vehicles and a horse. 
000000390935.jpg#1,Three vehicles parked outdoors with a horse standing nearby.
000000390935.jpg#2,A gravel pit with several cars and a horse.
000000390935.jpg#3,A group of people standing outside of a car next to a horse.
000000390935.jpg#4,The people have parked their cars near the horse.
000000305101.jpg#0,a railroad crossing and some cars and trees
000000305101.jpg#1,Cars stopped at the traffic light while cross traffic moves along.
000000305101.jpg#2,A person in a cream colored car waiting at a stop light
000000305101.jpg#3,A car is stopped at a railroad crossing
000000305101.jpg#4,The back side of a car that is stopped at a red light.
000000256607.jpg#0,A bus that is sitting near a building.
000000256607.jpg#1,A bus and car are parked in front of a building. 
000000256607.jpg#2,A red bus travels down a one way city street
000000256607.jpg#3,A transit bus moves through a narrow street. 
000000256607.jpg#4,A large red bus driving down the street.
000000539789.jpg#0,A compact car is parked beside many motorcycles.
000000539789.jpg#1,A small car parked in with the motorcycles on the road. 
000000539789.jpg#2,A parking lot line with parked cars in front of a building.
000000539789.jpg#3,A line of cars and motorbikes are shown in a row.
000000539789.jpg#4,a number of motorcycles parked near one another 
000000175801.jpg#0,a red car driving down a city road on a cloudy day
000000175801.jpg#1,A red bus driving past buildings under a cloudy blue sky.
000000175801.jpg#2,A red bus driving down a street with businesses.
000000175801.jpg#3,A bus stops to pick up passengers on a busy street.
000000175801.jpg#4,a red bus going down a road with a lot of buildings beside it 
000000515457.jpg#0,Several cars parked along the side of a street at night.
000000515457.jpg#1,A couple of cars parked on the side of a street at a traffic light.
000000515457.jpg#2,A city street with cars driving at night
000000515457.jpg#3,A street at night with cars in motion on it.
000000515457.jpg#4,THE VIEW OF A STREET WITH CARS PASSING BY AT NIGHT.
000000184669.jpg#0,A red Coke truck driving down a street under a traffic light.
000000184669.jpg#1,A red coca-cola truck makes a turn at an intersection.
000000184669.jpg#2,A Coca Cola truck is making a left hand turn at the intersection.
000000184669.jpg#3,A soda truck is seen turning the corner.
000000184669.jpg#4,a big cola truck going through an intersection
000000415530.jpg#0,Two trains traveling down a street lined with tall buildings.
000000415530.jpg#1,a tram that is driving on a city street
000000415530.jpg#2,Blue and white electric train running through an older looking city.
000000415530.jpg#3,Some large vehicles on a wide street near big buildings.
000000415530.jpg#4,A blue and white trolley traveling down the street
000000276894.jpg#0,Two men standing in front of a black car on a road. 
000000276894.jpg#1,Two men in dress clothes standing by a limousine.
000000276894.jpg#2,limo driver in a black suit standing outside of a limo
000000276894.jpg#3,Two men stand next to a limo that is parked to close to a fire hydrant.
000000276894.jpg#4,Two men standing next to a black limousine.
000000237685.jpg#0,a public transit bus on a city street near buildings 
000000237685.jpg#1,Picture of a car and the bus on the street.
000000237685.jpg#2,A bus is moving through a green light in the middle of a city.
000000237685.jpg#3,A bus drives through an intersection where the light is green. 
000000237685.jpg#4,Street scene with a bus going through a green light.
000000462505.jpg#0,A Manchester bus with passengers is traveling down the road. 
000000462505.jpg#1,a double deckered bus on a city street 
000000462505.jpg#2,A doubledecker bus comes down the street in town.
000000462505.jpg#3,A bus with Manchester riding down the street in a rural area.
000000462505.jpg#4,A bus sits next to a tree and sidewalk.
000000053406.jpg#0,A silver bus passing by cars on a street.
000000053406.jpg#1,The city bus is traveling down the road. 
000000053406.jpg#2,There is no image here to provide a caption for.
000000053406.jpg#3,a public transit bus on a city street
000000053406.jpg#4,A two car bus driving along a street.
000000184431.jpg#0,A picture of a very busy intersection with a subway line next to it.
000000184431.jpg#1,A row of colorful apartment buildings on a rainy day.
000000184431.jpg#2,"A highway, next to a train track and some condominium buildings."
000000184431.jpg#3,A bus that is sitting in the street.
000000184431.jpg#4,Vehicles driving on a road in front of skyscrapers.
000000347728.jpg#0,an image of a man holding an umbrella
000000347728.jpg#1,a guy walking down the road holding an umbrella.
000000347728.jpg#2,People walking with umbrellas on a wet city street.
000000347728.jpg#3,A young man with a blue umbrella crossing the street.
000000347728.jpg#4,a person walking on a street with an open umbrella
000000557434.jpg#0,Underweight oxen pulling cart in heavy traffic in native land.
000000557434.jpg#1,A busy street full of pedestrians and cars.
000000557434.jpg#2,A young boy stands in a city street in a jumble of traffic.
000000557434.jpg#3,A group of people standing around street with cars passing by.
000000557434.jpg#4,"A harnessed steer and several youths are standing in, two are biking through, a tight space afforded in the center of a knot of randomly placed cars and a truck loaded with cardboard boxes."
000000460470.jpg#0,A British double deck bus with an convertible top.
000000460470.jpg#1,a man hanging onto a pole while riding a red tour bus in London
000000460470.jpg#2,There are two double decker red busses besides each other
000000460470.jpg#3,A man on the back of a red bus.
000000460470.jpg#4,A double decker tour bus drives down the road with other buses and cars.
000000510799.jpg#0,A train traveling down train tracks next to a bunch of trees.
000000510799.jpg#1,Small passenger train moving along the train tracks
000000510799.jpg#2,An old fashioned passenger train traveling through the countryside.
000000510799.jpg#3,A passenger train is going down the track and people are in the car.
000000510799.jpg#4,a train with a bunch of passengers on it 
000000404221.jpg#0,A passenger bus that is driving down the street.
000000404221.jpg#1,A city bus is headed up a hill over a bridge.
000000404221.jpg#2,A bus that is sitting in the street.
000000404221.jpg#3,A bus drives down a narrow street lined with cars.
000000404221.jpg#4,A bus traveling down a road during the day.
000000151934.jpg#0,A blue city bus is parked next to a bus stop.
000000151934.jpg#1,a blue bus parked by a bus stop on a somewhat busy street 
000000151934.jpg#2,A passenger bus that is pulling up to the side of the street.
000000151934.jpg#3,A bus stopped at a terminal with other cars nearby.
000000151934.jpg#4,A blue bus parked in front of a bus stop.
000000110187.jpg#0,A woman standing in front of a doctors office.
000000110187.jpg#1,a lady that is standing next to a buliding
000000110187.jpg#2,A woman shooting her middle finger towards the camera.
000000110187.jpg#3,A woman on a sidewalk giving the finger.
000000110187.jpg#4,a woman is standing under a red sign
000000157923.jpg#0,An orange trolly cart passing a woman holding bags.
000000157923.jpg#1,An elderly person stepping out onto tracks in front of a street car.
000000157923.jpg#2,a person crossing the street in front an orange trolley while holding a garbage bag.
000000157923.jpg#3,A city ferry stopping for a man at a crosswalk.
000000157923.jpg#4,Orange mass transit trolley working it's way through a city. 
000000009286.jpg#0,A few school buses are parked near other vehicles. 
000000009286.jpg#1,There are three buses parked behind a fence.
000000009286.jpg#2,A parking lot with several large yellow buses.
000000009286.jpg#3,Several buses and cars parked in a dirt lot while a man walks by.
000000009286.jpg#4,This is a dirty parking lot with several school buses in it.
000000203458.jpg#0,The man is riding a pink bike threw traffic. 
000000203458.jpg#1,A man is on a pink bike in a crosswalk on a city street.
000000203458.jpg#2,A man riding a bike along side of traffic.
000000203458.jpg#3,A man on a pink and blue bicycle on a crosswalk in a city. 
000000203458.jpg#4,a man rides on a pink bicycle across the street
000000399332.jpg#0,A man riding a parked motorcycle next to a gas station.
000000399332.jpg#1,a man riding a motorcycle a drive in restaurant
000000399332.jpg#2,Some takes a picture from their car of a couple on a motorcycle.
000000399332.jpg#3,two people at a restaurant getting on a bike
000000399332.jpg#4,A man on a motorcycle and a person behind him parked next to a gas station.
000000319005.jpg#0,A view of buildings and cars on the street from under a rainbow colored umbrella.
000000319005.jpg#1,A rainbow colored umbrella beside a city street
000000319005.jpg#2,A multiple colored umbrella next to a table and truck.
000000319005.jpg#3,The cars are parked on the side of the street.
000000319005.jpg#4,a bunch of parked cars sitting in front of some buildings 
000000379086.jpg#0,Vehicle traffic in an uban area during winter.
000000379086.jpg#1,A bus is traveling at night on a non busy street.
000000379086.jpg#2,some people a bus and cars a street lights and buildings
000000379086.jpg#3,"Buses, cars, and few people on a busy street at night."
000000379086.jpg#4,A large bus and some people on a street.
000000573485.jpg#0,A red double decker passenger bus on the road.
000000573485.jpg#1,A bus is next to a van on a city street.  
000000573485.jpg#2,A red double decker bus driving next to a van.
000000573485.jpg#3,A red passenger bus makes its way past Big Ben in London.
000000573485.jpg#4,Red double-decker bus passing your white van on a city street. 
000000077689.jpg#0,A man is taking a picture in a rear view mirror.
000000077689.jpg#1,A woman taking a picture of her and a dog in a mirror.
000000077689.jpg#2,The woman in the mirror is taking a picture of herself and the dog.
000000077689.jpg#3,A woman in a car taking a photo of herself and her dog as seen from a side-view mirror .
000000077689.jpg#4,Seen as a reflection in a side view mirror: A woman sitting in the pasenger seat of a car with a dog in her lap and a camera in her hand 
000000135270.jpg#0,A green trash can sitting next to a tall building.
000000135270.jpg#1,A skateboarder riding the edge of a dumpster on the street
000000135270.jpg#2,Hooded skateboarder in mid air near a demolition pile.
000000135270.jpg#3,A man jumping over a pile of rocks with his skateboard. 
000000135270.jpg#4,The person is riding his skateboard in the street.
000000051990.jpg#0,a train on a train track on a city street
000000051990.jpg#1,"a blue and red train, looks like downtown"
000000051990.jpg#2,A train on a track going through a city.
000000051990.jpg#3,A big train is crossing the middle of a busy street. 
000000051990.jpg#4,an image of a train that is going thru the track
000000095266.jpg#0,A double decker bus traveling down a busy city street.
000000095266.jpg#1,A double decker bus is driving down the street.
000000095266.jpg#2,A double decker bus driving up a street.
000000095266.jpg#3,A blue double decker bus is going down the street.
000000095266.jpg#4,A double decker bus driving down the street
000000071499.jpg#0,Two red double decker buses driving past each other.
000000071499.jpg#1,Two red double decker buses on a street.
000000071499.jpg#2,Two big red multilevel buses on a narrow street.
000000071499.jpg#3,Two double-decker buses are driving down the street.
000000071499.jpg#4,Two double decker buses passing each other on a street 
000000059170.jpg#0,A double decker bus traveling the roads of London.
000000059170.jpg#1,A two story red bus drives around a road.
000000059170.jpg#2,a large red bus is by a curb
000000059170.jpg#3,A red Double Decker Bus headed for Uxbridge.
000000059170.jpg#4,Double decker bus in close traffic near a sports venue.
000000000923.jpg#0,a green train is coming down the tracks
000000000923.jpg#1,The train is on the tracks by the road.
000000000923.jpg#2,A train riding on a track near a platform.
000000000923.jpg#3,A commuter train pulling out of a suburban station.
000000000923.jpg#4,a green and yellow train on the train track
000000192594.jpg#0,A view of an empty city street at night
000000192594.jpg#1,A city with tall buildings and parked card lit up at night.
000000192594.jpg#2,Street lit up at night with parked cars on the side
000000192594.jpg#3,A steep street with streetcar rails going through a city.
000000192594.jpg#4,An image of a city skyline taken at night.
000000528796.jpg#0,A person walks next to a very large truck.
000000528796.jpg#1,A big yellow truck parked on a city street with a person walking by.
000000528796.jpg#2,a large yellow truck is on the street
000000528796.jpg#3,A woman walking on the side walk next to a large truck.
000000528796.jpg#4,a yellow truck parked in the middle of a road
000000079955.jpg#0,Pickup truck on a ramp preparing to merge with heavy Interstate highway traffic.
