000000423052.jpg#0,A sign and car on a city street.
000000423052.jpg#1,Store front on an old narrow city street with cars on it. 
000000423052.jpg#2,A sidewalk with a large sign that's been altered with graffiti. 
000000423052.jpg#3,"a vandalized parking sign that reads ""free cone"" instead of free parking"
000000423052.jpg#4,A sign points to a traffic cone above it.
000000407559.jpg#0,Scene of a building through the mirror of a vehicle.
000000407559.jpg#1,Rear view mirror of car with a sign reflected in it.
000000407559.jpg#2,City lights shine while a car rear view mirror reflects a building.
000000407559.jpg#3,Someone checks a side mirror while in their car. 
000000407559.jpg#4,There are some colored lights hanging from street lamps
000000107244.jpg#0,a street sign on a road near a building
000000107244.jpg#1,The car is driving down a slight curve on the road.
000000107244.jpg#2,A street with various signage and buildings around.
000000107244.jpg#3,A car that is sitting on the side of the street.
000000107244.jpg#4,A street with a car coming down hill by an older brick building.
000000396907.jpg#0,The car is driving down a quiet road. 
000000396907.jpg#1,a street light with signs on it near a bridge
000000396907.jpg#2,Dark car on roadway in cloudy urban setting.
000000396907.jpg#3,A car passing under a bridge next to lamppost.
000000396907.jpg#4,A streetlight overlooks a road and bridge with a building behind them.
000000518518.jpg#0,A large brown dog sitting in the drivers seat of a truck.
000000518518.jpg#1,The dog is sitting in the driver's seat of the car.
000000518518.jpg#2,Dog in the drivers seat of a green car.
000000518518.jpg#3,The dog is sitting in the car with the window down.
000000518518.jpg#4,The dog is sitting in the driver's seat of a car.
000000339344.jpg#0,A bus that is sitting in the street.
000000339344.jpg#1,A passenger bus that has parked on the side of the street.
000000339344.jpg#2,A multicolored bus with Russian lettering on the back parked by a sidewalk. 
000000339344.jpg#3,A yellow and orange bus stopped on the side of a road.
000000339344.jpg#4,A large passenger bus is on the street.
000000575343.jpg#0,A dog hanging out of the back door car window.
000000575343.jpg#1,a reflection of a dog in the side view mirror
000000575343.jpg#2,an image of a dog riding in the car with its head out the window
000000575343.jpg#3,The rear view mirror of a car showing a dog out a window.
000000575343.jpg#4,A side view mirror with a reflection of a dog.
000000473214.jpg#0,A road that has a car driving down it.
000000473214.jpg#1,A car is coming down a winding road. 
000000473214.jpg#2,a red soda machine on a long road
000000473214.jpg#3,"A lot of building on each side of the road, with a very curvy road in the middle."
000000473214.jpg#4,A car that is sitting int he street near a building.
000000432120.jpg#0,A dog hanging out of back door window in a car.
000000432120.jpg#1,A dog in a car is viewed from the car's side  mirror.
000000432120.jpg#2,Dog looking out the window of a car in rearview mirror.
000000432120.jpg#3,A rear view mirror shows a giraffe looking behind a car.
000000432120.jpg#4,Dogs love to ride with their heads out the car window.
000000559557.jpg#0,A cat on the hood of a car gets ready to pounce.
000000559557.jpg#1,A cat crouched on the hood of a car
000000559557.jpg#2,a cat sitting on the top of a car hood
000000559557.jpg#3,a cat is kneeling on top of a car
000000559557.jpg#4,A cat sitting on top of the hood of a car.
000000489687.jpg#0,A cat sitting on top of a a black car.
000000489687.jpg#1,A cat is lying on the hood of a black car.
000000489687.jpg#2,An orange cat laying on top of a black car.
000000489687.jpg#3,A white and tan cat laying on top of a black BMW
000000489687.jpg#4,A cat sitting on top of a car and resting.
000000460702.jpg#0,A car with a dog sitting in the front seat.
000000460702.jpg#1,An economy car is parked on the side of the road with a dog in the passenger's seat.
000000460702.jpg#2,The dog is sitting in the driver's seat of a silver car.
000000460702.jpg#3,"A dog sitting in the drivers seat of a car. 
"
000000460702.jpg#4,A car with a dog sitting in the front seat.
000000284084.jpg#0,A very tall giraffe in a safari adventure where people can watch them from their cars.
000000284084.jpg#1,A giraffe standing on top of a dirt hill.
000000284084.jpg#2,A giraffe is standing in the grass near a car.
000000284084.jpg#3,A giraffe standing in the middle of an open area with a car in front of it.
000000284084.jpg#4,A giraffe standing on sandy soil looks over a car.
000000235536.jpg#0,The car is driving on the wet road. 
000000235536.jpg#1,A yellow truck driving along a wet muddy road.
000000235536.jpg#2,a jeep rides in the dark with its headlights on through a muddy road
000000235536.jpg#3,The jeep is being driven down the muddy road.
000000235536.jpg#4,A yellow jeep riding down a muddy road at night.
000000034884.jpg#0,A pretty cat sits on a car posing for a picture.
000000034884.jpg#1,a cat sitting on the hood of a white car
000000034884.jpg#2,tHERE IS A CAT SITTING ON THE HOOD OF A SILVER CAR
000000034884.jpg#3,A cat sitting on the hood of a silver car.
000000034884.jpg#4,A cat sitting on the front of a car.
000000329147.jpg#0,A cat laying on top of the hood of a car.
000000329147.jpg#1,A cat is laying on the hood of a car. 
000000329147.jpg#2,a cat on a BMW car bonnet sleeping
000000329147.jpg#3,A fluffy cat is lying on top of a BMW car.
000000329147.jpg#4,A tabby cat asleep on the hood of a BMW car. 
000000497441.jpg#0,A blue car and white truck next to bushes in yard.
000000497441.jpg#1,Beat up old car and truck sit out in the yard
000000497441.jpg#2,The old cars are parked in the driveway.
000000497441.jpg#3,A rusted out truck parked behind a blue older car.
000000497441.jpg#4,A truck and a car parked in a driveway.
000000293785.jpg#0,A white truck parked in front of a store with lots of windows.
000000293785.jpg#1,A large white building on the corner of a street .
000000293785.jpg#2,A white building storefront has a van and car parked in front of it. 
000000293785.jpg#3,A white vehicle in front of a building.
000000293785.jpg#4,A delivery truck is parked in front of a store.
000000193853.jpg#0,A cat on the curb in front of a cars bumber
000000193853.jpg#1,A pretty white andorange cat walks along a widewalk
000000193853.jpg#2,The cat is standing in front of the car. 
000000193853.jpg#3,A cat walking down a sidewalk pauses in front of a parked car.
000000193853.jpg#4,A cat passes in front of the grate of a blue car.
000000112938.jpg#0,a blurry photo of a bench near a fence 
000000112938.jpg#1,Gloomy view of outside from large vacant window
000000112938.jpg#2,A view of an entrance to a train station.
000000112938.jpg#3,An area that has surrounded by a metal fence.
000000112938.jpg#4,some sun peeking under the top part of a tree
000000042919.jpg#0,The back side of a truck traveling down a road hauling tree trunks 
000000042919.jpg#1,THERE IS A PULP WOOD EIGHTEEN WHEELER TRACTOR TRAIOR ON THE STREET 
000000042919.jpg#2,a truck with many tree trunks in the back
000000042919.jpg#3,A truck driving down a road with lots of logs on it's back.
000000042919.jpg#4,A truck that has a bunch of logs in the back.
000000332362.jpg#0,A striped cat standing on the side window of a car.
000000332362.jpg#1,a cat is standing on a car window
000000332362.jpg#2,A cat walking on side of a car with tail raised
000000332362.jpg#3,A cat walking on an automobile door beside the side window.
000000332362.jpg#4,A tabby cat balances on the edge of a car window.
000000384935.jpg#0,A dog sticking its head out of the car window and viewed from the side mirror. 
000000384935.jpg#1,A dog has a reflection in a car's rear view mirror.
000000384935.jpg#2,A puppy hanging outside of a car in a driveway.
000000384935.jpg#3,A dog being reflected in a rear view mirror on the side of a car.
000000384935.jpg#4,"Dog hanging out a car window, as seen in a side view car mirror."
000000386973.jpg#0,A car with a bike tied to the back of it.
000000386973.jpg#1,a car with a bike strapped on the trunk
000000386973.jpg#2,A car parked next to a house with a bike on a bike rack on it.
000000386973.jpg#3,A car with a bike on the back of it sitting in a field.
000000386973.jpg#4,Bicycle sitting on bike rack on back of car
000000108156.jpg#0,A rear view mirror view shows a truck coming up behind.
000000108156.jpg#1,A semi truck is seen in the reflection of a rear view mirror.
000000108156.jpg#2,A large truck is shown in a rear view mirror.
000000108156.jpg#3,The reflection of a truck in the side view mirror.
000000108156.jpg#4,The from of a semi truck seen from a car's side mirror
000000466597.jpg#0,A cat laying down under a light blue car.
000000466597.jpg#1,A cat crouching under a parked blue car
000000466597.jpg#2,a blue car with a cat laying underneath it
000000466597.jpg#3,A cat is standing under a blue vehicles
000000466597.jpg#4,A gray is crouching under a blue car.
000000314538.jpg#0,A driveway with a car parked in it .
000000314538.jpg#1,A car parked in front of a building near a tree.
000000314538.jpg#2,A car is parked in front of the house
000000314538.jpg#3,A car parked next to a house with something white on top of it. 
000000314538.jpg#4,A car parked near a home with a cat sitting on it 
000000511583.jpg#0,A car is parked on a street at night.
000000511583.jpg#1,Car parked on street next to sidewalk in night scene
000000511583.jpg#2,A gray Ford Crown Victoria parked on a city street at night.
000000511583.jpg#3,A car parked next to a brick sidewalk on a street at night.
000000511583.jpg#4,a car that is parked next to a fire hydrogen 
000000045188.jpg#0,This cool cake is in the shape of a car.
000000045188.jpg#1,The cake is made to look like a car that has a face.
000000045188.jpg#2,A birthday cake is themed from  a character from Cars.
000000045188.jpg#3,A Cars Cartoon cake sitting on a Gold Foil plate.
000000045188.jpg#4,A car decorated to look like a car
000000103127.jpg#0,A car's side mirror shows a dog sticking his head out of the window.
000000103127.jpg#1,A dog hangs its head out the back window of a car.
000000103127.jpg#2,Looking at the passenger side mirror to see a dog's head out the window.
000000103127.jpg#3,A side view mirror hanging off the side of a car door.
000000103127.jpg#4,Dogs love to stick their heads out into the wind when riding in a car.
000000487353.jpg#0,A truck is covered all over in graffiti
000000487353.jpg#1,a truck with graffiti written all over it 
000000487353.jpg#2,A delivery truck covered in graffiti driving down a street.
000000487353.jpg#3,A truck painted with pop art all over it 
000000487353.jpg#4,A truck parked in a lot and covered with graffiti 
000000075496.jpg#0,a hummingbird flying next to the rear view mirror of a car
000000075496.jpg#1,A bird flying into the mirror on a car. 
000000075496.jpg#2,A side view mirror that has a bird looking in it.
000000075496.jpg#3,A bird is attacking its own reflection in a car's side mirror.
000000075496.jpg#4,A bird flying into the side mirror of a red vehicle. 
000000521721.jpg#0,a red bird flying past a car window
000000521721.jpg#1,a bird is flying into the window of a car
000000521721.jpg#2,A bird that is flying near a car window.
000000521721.jpg#3,Feathers are outside of a car window near the side mirror. 
000000521721.jpg#4,A red bird fluttering next to a car window.
000000421569.jpg#0,A brown and white dog on street next to a blue car.
000000421569.jpg#1,A dog is standing on the street next to a car.
000000421569.jpg#2,A cute golden dog is standing in the street.
000000421569.jpg#3,A dog stands in the middle of a road.
000000421569.jpg#4,light brown cocker spaniel dog howling in street
000000160211.jpg#0,One hairy dog with sharp teeth riding with his head out the car window.
000000160211.jpg#1,The reflection of a dog putting its head out of a car window.
000000160211.jpg#2,a reflection in a side view mirror of a dog hanging out the car 
000000160211.jpg#3,a white dog with his head out of a car window 
000000160211.jpg#4,A white dog is leaning out of the window.
000000194306.jpg#0,A white dog sitting inside a red car next to a string of flowers hanging off the mirror.
000000194306.jpg#1,A small white dog inside of a red car.
000000194306.jpg#2,A blissful dog laying against a windscreen of a car
000000194306.jpg#3,a dog that  is sitting in a red car
000000194306.jpg#4,A white dog sitting in the front seat of a red car.
000000242564.jpg#0,A dog sits in the window of a vehicle.
000000242564.jpg#1,A car with a dog inside it parked in the street.
000000242564.jpg#2,There is a small yellow car parked with a dog waiting on the inside. 
000000242564.jpg#3,A yellow subcompact car with a dog in it.
000000242564.jpg#4,a close up of a small car with a dog inside
000000050786.jpg#0,A white truck is near some trees in the background.
000000050786.jpg#1,A food truck with screen covers across the windows.
000000050786.jpg#2,An old looking white van is close up.
000000050786.jpg#3,The delivery truck is parked o the side of the road.
000000050786.jpg#4,A white food truck is parked outside in the sun.
000000115954.jpg#0,School bus traveling down a residential street brakes for passing car. 
000000115954.jpg#1,A school bus that is stopped by a turn off.
000000115954.jpg#2,A photo taken from a car looking at the back of a school bus.
000000115954.jpg#3,A yellow school bus driving down a road.
000000115954.jpg#4,A large yellow school bus on a road.
000000560254.jpg#0,A green and white bus driving past a blue bus stop.
000000560254.jpg#1,A city bus pulled up to a street curb
000000560254.jpg#2,A CITY COMMUTER BUS IS PARKED ON THE CURB 
000000560254.jpg#3,"A green bus parked by the curb next to a bus stop, with some snow on the ground."
000000560254.jpg#4,a public bus parked by a blue bus stop
000000406932.jpg#0,A dog hanging out of a side window on a car.
000000406932.jpg#1,Dog looking out car window as reflected in side view mirror.
000000406932.jpg#2,A dog with his head out of the window and tongue hanging as seen in a car mirror.
000000406932.jpg#3,a dog look through a cars window 
000000406932.jpg#4,A dog's reflection in a car door mirror.
000000372615.jpg#0,A car driving down a street with a side view mirror.
000000372615.jpg#1,a dog with his head out of the window seen through a car mirror 
000000372615.jpg#2,The dog is hanging out of the back car window.
000000372615.jpg#3,A dog is poking it's head out the window of a car as it rides toward the mountain.
000000372615.jpg#4,View out passenger side of a mountain and green field
000000407422.jpg#0,A taxi cab parked next to a brown teddy bear laying in a street.
000000407422.jpg#1,A teddy bear lying face down on the street as a taxi drives past. 
000000407422.jpg#2,a stuffed animal near a car on a city street
000000407422.jpg#3,A stuffed teddy bear face down on the street with a cab beside it.
000000407422.jpg#4,A brown teddy bear laying in the middle of a street while a taxi passes by. 
000000038905.jpg#0,an old photo of a public transit bus driving on a street
000000038905.jpg#1,an old fashioned bus parked by the side of the road
000000038905.jpg#2,a bus traveling down an asphalt road next to a sidewalk.
000000038905.jpg#3,The bus is  leaving this residential section of town and traveling across a viaduct.
000000038905.jpg#4,A bus rides down an empty residential street.
000000093000.jpg#0,A train is traveling down the tracks in a deserted area.
000000093000.jpg#1,A train on the tracks alongside a brick wall 
000000093000.jpg#2,A train coming out of a tunnel and rounding a corner.
000000093000.jpg#3,A freight train moving slowly down the tracks.
000000093000.jpg#4,A train going down the track just after passing under a overpass.
000000292977.jpg#0,a dog is sticking its head out of a window
000000292977.jpg#1,A black fluffy dog sticks its head out of a van window.
000000292977.jpg#2,"A black dog, peering out the drivers window of a mini-van."
000000292977.jpg#3,A gray shaggy dog hanging out the driver side window of a blue minivan.
000000292977.jpg#4,"A fluffy, black dog leaning out of a car window."
000000099584.jpg#0,A transit bus stopped at a street side that's filled with snow.
000000099584.jpg#1,A white bus with a painting of a blue flower on the front stopped on a street near a snow covered sidewalk. 
000000099584.jpg#2,An empty bus parked on the side of a road.
000000099584.jpg#3,A picture of a bus stopped on the street.
000000099584.jpg#4,A bus pulled over on the road next to some snow.
000000270583.jpg#0,A car driving down a road next to a street sign.
000000270583.jpg#1,A bird perched on a guardrail as a car drives by.
000000270583.jpg#2,A car driving on the road near a road sign and a bird.
000000270583.jpg#3,A car passing a street sign indicating no right turns.
000000270583.jpg#4,A black bird sitting on the hood of a car near a no parking sign.
000000512796.jpg#0,A side view mirror hanging off the side of a door.
000000512796.jpg#1,A bull in the side view mirror of a car.
000000512796.jpg#2,A view of a cow in a car's mirror. 
000000512796.jpg#3,The rear view mirror of a vehicle with the reflection of a cow.
000000512796.jpg#4,A RED CARS VIEW OF A COW IN THE REAR VIEW MIRROR 
000000418624.jpg#0,A picture of a toy car and bus on carpet.
000000418624.jpg#1,A toy bus and care are parked on carpet.
000000418624.jpg#2,A toy bus and car on a large grassy area.
000000418624.jpg#3,A toy bus is on a carpet with a toy car in the background.
000000418624.jpg#4,A bus and a car that are in a field.
000000523360.jpg#0,A cement wall with a picture on it and a small four door vehicle parked below the picture.
000000523360.jpg#1,a little car sitting by a wall with a picture on it 
000000523360.jpg#2,A car is parked on a street near a sign.
000000523360.jpg#3,The car with a rack on it's roof is parked next to a street sign. 
000000523360.jpg#4,A car is parked under a unique sign.
000000338994.jpg#0,Someone looks through their side view mirror at the dog on the back of the truck.
000000338994.jpg#1,The rearview mirror shows a dog looking out of a car
000000338994.jpg#2,A car mirror reflects a dog's head and some trees.
000000338994.jpg#3,A rear view mirror on the side of a car door.
000000338994.jpg#4,A dog shown in the side view mirror of a car.
000000097049.jpg#0,A dog hanging out of a car in front of a rear view mirror.
000000097049.jpg#1,A reflection in a vehicles side view mirror of a dog with it's head sticking out of a window.
000000097049.jpg#2,A reflection of a dog sticking his head out of the car window.
000000097049.jpg#3,Rearview mirror view of a dog sticking its head out car window. 
000000097049.jpg#4,A car's side view mirror reflects a dog hanging its head out the window.
000000340096.jpg#0,A stop sign covered in lights at a street intersection.
000000340096.jpg#1,A stop sign that is decorated with Christmas lights.
000000340096.jpg#2,a decorated lite up stop sign at the corner
000000340096.jpg#3,car comes to the curve to stop at the stop sign
000000340096.jpg#4,A stop sign covered in a white lights. 
000000021571.jpg#0,A dog sitting behind a window at a house.
000000021571.jpg#1,A very cute dog looking out the window of a nice house.
000000021571.jpg#2,a dog stares out of a window 
000000021571.jpg#3,a dog sitting in a window looking at a vehicle
000000021571.jpg#4,a dog sits lonely in a window in a gray house
000000441165.jpg#0,A cat sleeping on the car made of metal
000000441165.jpg#1,A cat sleeping on the roof of a car.
000000441165.jpg#2,A small cat sitting on top of a parked car.
000000441165.jpg#3,The cat is laying on top of the vehicle.
000000441165.jpg#4,A multicolored cat taking a nap on the roof of a car.
000000352601.jpg#0,A cat rolls around on the hood of a car. 
000000352601.jpg#1,A cat sleeping with his head upside down on the hood of a car.
000000352601.jpg#2,acat laying on the hood of a car
000000352601.jpg#3,The cat is relaxing on the hood of the car.
000000352601.jpg#4,A cat laying on the hood of a car in a driveway.
000000510006.jpg#0,THERE IS A CAT ON THE CAR BACK SEAT
000000510006.jpg#1,A gray and white cat sitting in the back window of a car.
000000510006.jpg#2,A cat grooming itself in the back window of a car.
000000510006.jpg#3,A cat basks in the sun in the back of a car.
000000510006.jpg#4,A cat is sitting in a car licking itself.
000000445408.jpg#0,A picture of the side of a car with a plan in the background. 
000000445408.jpg#1,A car in a street with an airplane taxining in the background
000000445408.jpg#2,View of a car and a plane from inside another car
000000445408.jpg#3,An airplane on an overpass close to parked cars.
000000445408.jpg#4,Someone in a car taking a picture of another car and an airplane.
000000335119.jpg#0,A car and a bus behind a fence.
000000335119.jpg#1,A graffiti covered bus in a fenced in parking lot.
000000335119.jpg#2,The bus behind the fence has a lot of graffiti on it.
000000335119.jpg#3,A car is parked next to a colorfully painted bus.
000000335119.jpg#4,A spray painted bus is parked beside a minivan.
000000498081.jpg#0,"A truck is parked in a driveway in the snow.
"
000000498081.jpg#1,An old car is sitting in a snowy driveway.
000000498081.jpg#2,A truck parked in the snow near several trees.
000000498081.jpg#3,A strange car sitting in the snow near a bush
000000498081.jpg#4,The old car is beige and is parked in the snow. 
000000041342.jpg#0,The windshield of a bus that is in the street.
000000041342.jpg#1,large bus with a reflection of the sky and clouds on its windshield
000000041342.jpg#2,The front of a bus in a closeup shot 
000000041342.jpg#3,There is a large passenger bus and the sky is reflected in its front window.
000000041342.jpg#4,A large white and black bus drives down the road.
000000525361.jpg#0,A train pulled into a train station next to a loading platform.
000000525361.jpg#1,"A yellow, white and blue train next to a train station."
000000525361.jpg#2,A yellow and blue train pulls into a train station.
000000525361.jpg#3,a yellow and white passenger train parked beside a train platform 
000000525361.jpg#4,A passenger train is stopped at a train station.
000000020613.jpg#0,A dog is in a car with his nose up to the partially rolled down window.
000000020613.jpg#1,A dog looks out of a half opened car window.
000000020613.jpg#2,A dog taking a ride in the back seat of a silver car.
000000020613.jpg#3,A dog in the back seat of a car looking out the window.
000000020613.jpg#4,A dog peers through an open car window
000000397375.jpg#0,A dog sitting in the passenger seat of a car.
000000397375.jpg#1,A dog pokes his head up in the window of a white car.
000000397375.jpg#2,A dog looking out a window of a car.
000000397375.jpg#3,A dog sitting in the passenger seat of a car. 
000000397375.jpg#4,A dog peeking out of a car's window.
000000218850.jpg#0,A large blue train traveling past some houses on rail road tracks
000000218850.jpg#1,A train travels on tracks through a residential area.
000000218850.jpg#2,A train going through a residential neighborhood. 
000000218850.jpg#3,A train traveling down a track with houses on either side.
000000218850.jpg#4,A train sitting on train tracks running through a town.
000000162747.jpg#0,A small orange train traveling down tracks near a station.
000000162747.jpg#1,A freight train coming in to the platform of a small station
000000162747.jpg#2,a train parked at a train platform 
000000162747.jpg#3,a train next to a bridge sitting on a train track
000000162747.jpg#4,A train pulls up to a train stop.
000000179331.jpg#0,A white dog with it's head hanging out of the side of a window.
000000179331.jpg#1,A dog's reflection is in a rear view mirror.
000000179331.jpg#2,The image of a white dog in a car mirror poking his head outside of the window of a moving car.
000000179331.jpg#3,A dog looking out of a car window is reflected in the side view mirror.
000000179331.jpg#4,"An image of a dog sticking its' head out a car window, taken from a side mirror."
000000357944.jpg#0,A tall green building with a massive tall brown clock tower behind it.
000000357944.jpg#1,A white car parked in front of a building.
000000357944.jpg#2,There is a police car parked in front of an old building.
000000357944.jpg#3,A police car is parked outside the waiting room at Lackawanna Rail Road.
000000357944.jpg#4,a police car parked outside of a building 
000000052388.jpg#0,A white delivery truck parked on the side of a road.
000000052388.jpg#1,A truck parked in a street with graffiti writing on its hood.
000000052388.jpg#2,A truck is on the street with a red background.
000000052388.jpg#3,Photo of a bus parked at a curb near a building in a reddish light.
000000052388.jpg#4,A truck parked on the side of a street. 
000000570978.jpg#0,A double decker bus parked near a building
000000570978.jpg#1,a double stacker yellow passenger bus outside an apartment building
000000570978.jpg#2,A doubledecker bus traveling on a city street.
000000570978.jpg#3,A yellow double decker bus moving down a street.
000000570978.jpg#4,A yellow bus that is a double-decker bus on a road.
000000197716.jpg#0,A bus parked on a street next to a tree.
000000197716.jpg#1,A colorful bus on the street next to a tree.
000000197716.jpg#2,There is a bus 61A stop at the street
000000197716.jpg#3,The city bus is parked on the side of the road. 
000000197716.jpg#4,A blue bus is parked by a strip of grass.
000000127997.jpg#0,A tractor trailer on one side of a road and a car travelling behind another car can be seen in the car's mirror. 
000000127997.jpg#1,a car side view mirror passing a tractor trailer truck
000000127997.jpg#2,A UPS 18-wheeler traveling on the opposite side of the street.
000000127997.jpg#3,a mirror outside of a vehicle driving down the street
000000127997.jpg#4,Right mirror of a silver colored driving vehicle. 
